response_text,count
"""아니요, 전혀 함정 없습니다! 저희는 고객님께서 보험을 연결해주시면 정직하게 광고비를 지급해드리는 시스템입니다. 자세한 내용은 문자로 보내드릴 수 있습니다""",2
"""아니요, 전혀 사기가 아닙니다. 저희는 정식으로 다이렉트 자동차보험 비교견적 서비스를 제공하는 회사입니다. 믿고 문의해주셔도 됩니다. 😊""",2
"""아니요, 전혀 그런 함정은 없습니다. 단순히 자동차보험 연결해주시면 혜택을 드리는 프로그램입니다. 궁금하신 점 있으시면 언제든지 말씀해 주세요""",2
"""아니요, 전혀 그런 함정 없습니다! 저희는 고객님께 직접 보험을 연결해드리고, 광고비를 보장해드리는 프로그램입니다. 믿고 진행하셔도 됩니다""",2
"""아니요, 전혀 그런 함정 없습니다! 고객님께 소개해 주시면 광고비를 바로 지급해드리는 간단한 시스템입니다. 궁금하신 점이 있으시면 언제든지 질문해 주세요""",2
"""아니요, 저희는 자동차보험을 연결해주시면 최대 7%의 수수료를 드리고 있습니다. 다른 수수료는 없어요""",2
"""아니요, 온라인이 아니어도 가능합니다. 오프라인으로도 진행할 수 있으니 편하신 방법으로 연락주시면 됩니다""",2
"""아니요, 온라인이 아니어도 가능합니다. 오프라인으로도 진행할 수 있으니 편하신 방법으로 말씀해 주시면 됩니다""",2
"""아니요, 온라인이 아니더라도 고객님께서 소개해주시면 저희가 직접 진행 가능합니다. 간단하게 연락만 주시면 됩니다""",2
"""아, 그러시군요! 현재 이용 중인 업체와 비교해보시면 좋을 것 같아요. 저희는 **수수료 7%**로 혜택을 드리고 있으니, 필요하시면 언제든지 연락 주세요! 문자로도 간단한 정보 드릴게요. 📩""",2
"""아니요, 온라인뿐만 아니라 오프라인에서도 진행 가능합니다. 원하는 방식으로 진행하시면 됩니다""",2
"""아니요, 온라인 외에도 전화로도 가능합니다. 고객님께서 편한 방법으로 의뢰해주시면 됩니다""",2
"""아니요, 소개료는 보험료의 7%를 지급해드리며, **다음날 바로 지급**해드리는 방식입니다. 현금이 아닌 다이렉트 금액으로 지급됩니다""",2
"""아니요, 사기가 아닙니다. 저희는 정식으로 운영되는 다이렉트 자동차보험 비교견적 회사입니다. 믿고 문의 주셔도 괜찮습니다""",2
"""아니요, 사기가 아닙니다. 저희는 정식으로 다이렉트 자동차보험 비교견적 서비스를 제공하고 있습니다. 믿고 문의 주시면 자세히 안내해드리겠습니다""",2
"""아니요, 사기가 아닙니다! 저희는 정식으로 운영되는 다이렉트 자동차보험 비교견적 회사입니다. 믿고 연락 주시면 상세한 안내 도와드리겠습니다""",2
"""아니요, 사기 아닙니다. 저희는 다이렉트 자동차보험 비교견적을 제공하는 업체입니다. 진짜 혜택과 수수료 지급을 약속드립니다. 궁금하신 점 있으시면 말씀해 주세요""",2
"""아니요, 다른 비용은 없습니다. 보험료의 **7%**만 지급되며, 견적 의뢰하시면 **cu 모바일 상품권 5천원**도 드립니다.""",2
"""아니요, 다른 비용은 없습니다. 고객님이 소개해 주신 분이 가입하시면 수수료를 지급해드리는 구조입니다. 추가 비용 없이 진행되니 안심하셔도 됩니다""",2
"""아니요, 다른 비용은 없습니다. 고객님께서 소개해주신 계약이 성사되면 보험료의 7%를 지급해드립니다. 추가 비용 없이 진행됩니다""",2
"""아니요, 온라인뿐만 아니라 오프라인으로도 가능합니다. 고객님이 원하시는 방법으로 진행하실 수 있습니다.""",2
"""안녕하세요, 자동차보험 다이렉트 비교견적 서비스 **차집사**입니다. 고객님을 소개해주시면 **광고비로 최대 7%** 지급해드리는 내용입니다. 자세한 내용은 문자로 보내드릴게요""",2
"""안녕하세요, 요청하신 내용 확인했습니다. 연락 중단해드리겠습니다. 감사합니다""",2
"""안녕하세요, 000팀장님! 다이렉트 자동차보험 차집사 김은주입니다. 고객님들에게 자동차보험을 소개해주시면 광고비를 지급하는 제안을 드리고 싶습니다. 잠깐 시간 괜찮으신가요""",2
감사합니다! 팀장님도 좋은 하루 되세요! 😊,2
"""안녕하세요! 고객님이 소개해주신 차량 보험 가입이 완료되면, 다음 날 바로 광고비를 지급해드립니다. 더 궁금하신 점 있으신가요""",2
"""아니요, 현금은 아니고 **다이렉트 금액**으로 지급됩니다. 대신 **cu 상품권**으로 제공해드려요. 추가로 궁금한 점 있으신가요""",2
"""아니요, 해지 시 손해가 아니에요. 새로운 보험으로 더 나은 조건을 찾을 수 있으니 이점이 있습니다. 언제든지 상담해 드릴 수 있어요""",2
"""아니요, 함정 없습니다! 안전하고 믿을 수 있는 서비스입니다. 궁금한 점 있으시면 언제든지 문의 주세요""",2
"""아니요, 함정 없습니다! 많은 딜러님들이 함께하고 계시고 체결율도 95% 이상이에요. 간단하게 소개만 해주시면 빠르게 수수료도 지급되니, 믿고 진행해보세요""",2
"""아니요, 추가 비용은 전혀 없습니다. 계약이 성사되면 보험료의 7%만 지급됩니다. 궁금한 점 더 있으신가요""",2
"""아니요, 전혀 함정이 없습니다. 간단하게 고객님을 연결해드리고, 광고비를 드리는 시스템입니다. 걱정하지 않으셔도 됩니다!""",2
"""아니요, 추가 비용은 없습니다. 고객님 소개만 해주시면 혜택을 드립니다""",2
"""아니요, 추가 비용은 없습니다. 계약 성사 시 보험료의 7%만 지급됩니다""",2
"""아니요, 직접 만날 필요는 없습니다. 전화나 문자로도 간편하게 진행 가능합니다. 필요하신 정보 말씀해주시면 바로 도와드릴게요""",2
"""아니요, 직접 만나지 않으셔도 됩니다. 전화나 문자로도 충분히 진행할 수 있습니다. 필요하시면 언제든지 연락주세요""",2
"""아니요, 직접 만나지 않으셔도 됩니다. 전화나 문자로도 충분히 진행 가능합니다. 필요하신 정보는 문자로 보내드릴게요""",2
"""아니요, 직접 만나지 않으셔도 됩니다. 전화나 문자로 간편하게 진행하실 수 있어요. 필요하신 정보는 언제든지 제공해드리겠습니다!""",2
"""아니요, 직접 만나지 않으셔도 됩니다. 전화나 문자로 간편하게 안내해드릴 수 있습니다. 필요하시면 자세한 내용을 문자로 보내드릴게요""",2
"""아니요, 직접 만나지 않으셔도 괜찮습니다. 전화나 문자로도 충분히 안내해드릴 수 있습니다. 궁금하신 점 있으시면 언제든지 말씀해 주세요""",2
"""아니요, 직접 만나지 않아도 됩니다. 전화와 문자로 간편하게 진행할 수 있습니다. 필요하신 내용은 언제든지 문의해 주세요""",2
"""아니요, 지금 바로 가입은 어렵습니다. 고객님을 소개해주시면, 가입한 고객님의 보험사로 직접 연결해드리고, 수수료는 익일 오후에 지급해드립니다""",2
"""아니요, 절대 사기가 아닙니다! 저희 차집사는 정식으로 운영되는 다이렉트 자동차보험 비교견적 회사입니다. 정말로 고객님들께 혜택을 드리고 있습니다. 더 궁금한 점 있으시면 말씀해 주세요""",2
"""아니요, 추가 비용은 없습니다. 보험료 비교 견적만으로도 cu 모바일 상품권 5천원을 드리고, 계약 성사 시 보험료의 7%를 지급해드립니다""",2
"""아, 알겠습니다! 간단한 내용 문자로 보내드릴게요. 필요한 경우 연락주시면 됩니다. 감사합니다""",2
"""아, 아닙니다! 저희는 정식으로 운영되는 다이렉트 자동차보험 비교견적 회사입니다. 간단한 광고 제안이니 편안하게 생각해 주세요. 필요하시면 문자로 더 자세한 내용도 보내드릴게요""",2
"""아, 불편을 드려서 죄송합니다. 간단한 정보 문자 보내드릴게요. 감사합니다""",2
"""아, 다른 업체에 가입하셨군요! 저희는 수수료가 최대 7%로 매우 유리한 조건이니 참고해주시면 좋을 것 같습니다. 자세한 내용은 문자로 보내드릴게요. 감사합니다""",2
"""아, 네! 회의 잘 마치세요. 필요하시면 문자로 자세한 내용 보내드릴게요. 감사합니다""",2
"""아, 네! 현재 이용하시는 업체가 괜찮으시군요. 😊 혹시 필요하실 때 언제든지 연락 주시면 좋겠습니다! 차집사에 대한 간단한 정보 문자 보내드릴게요. 감사합니다""",2
"""아, 그렇다면 계약 기간이 끝나면 저희와 함께해보시면 좋을 것 같습니다. 나중에 관심 있으시면 편하게 연락주세요. 문자로 더 자세한 내용 보내드릴게요! 감사합니다""",2
"""아, 그렇군요! 혹시 필요하실 때 저희 정보를 기억해 주시면 좋겠습니다. 나중에 가격비교도 해보실 수 있으니 문자로 간단한 정보 보내드릴게요. 감사합니다! 😊""",2
"""아, 그렇군요! 현재 이용 중이신 보험과 비교해보실 기회가 있으니, 나중에라도 문의 주시면 좋겠습니다. 간단한 홍보 문구와 함께 문자 보내드릴게요. 감사합니다""",2
"""아, 그렇군요! 차집사에서는 다양한 혜택과 보장 내용을 제공하고 있으니, 혹시 나중에라도 관심 있으시면 연락주세요. 오늘 상담 내용 문자로 보내드릴게요! 감사합니다""",2
"""아니요, 다른 비용은 없습니다. 계약이 성사되면 보험료의 7%만 지급됩니다. 궁금한 점이 더 있으시면 언제든지 말씀해 주세요""",2
"""아, 그렇군요! 이미 가입하셨다면 정말 좋습니다. 혹시 주변에 가입할 분이 있으면 저희를 소개해 주시면 감사하겠습니다. 작은 혜택도 드리고 있으니 문자로 정보 보내드릴게요! 😊""",2
"""아, 그렇군요! 안전 운전하시고요. 제가 간단한 정보 문자 보내드릴게요. 감사합니다""",2
"""아, 그렇군요! 다음번엔 꼭 소개해주시면 혜택 드릴 수 있습니다. 오늘 문자 보냈으니 확인해보세요. 감사합니다""",2
"""아, 그렇군요! 그분께 제안 내용 전달해주시면 좋을 것 같습니다. 필요하시면 제가 간단한 안내 문구와 함께 문자도 보내드릴 수 있어요""",2
"""아, 그렇군요! 그래도 저희 차집사 상품이 필요하실 때 꼭 기억해 주세요. 문자로 상세 내용 보내드릴게요. 감사합니다""",2
"""아, 그렇군요! 고객님께서 만족하신다니 다행입니다. 혹시 나중에라도 필요하시면 언제든지 연락주세요. 문자로 자세한 내용 보내드릴게요. 감사합니다""",2
"""아, 그렇군요! 결정권자와 연결될 수 있도록 연락처를 주시면 제가 안내 도와드리겠습니다. 😊""",2
"""아, 그렇군요! 결정권자분께도 저희 혜택을 안내드릴 수 있도록 연락처를 주시면 저희가 직접 연락드리겠습니다. 감사합니다""",2
"""아, 그렇군요! 가입한 고객님 보험사로 직접 연결도 해드리니 필요하시면 언제든지 말씀해 주세요. 문자로 간단한 정보도 보내드릴게요. 감사합니다""",2
"""아, 그럴 수도 있죠. 저희는 사고가 많거나 가입이 어려운 고객님도 오프라인으로 가입 가능하게 도와드리고 있습니다. 혹시 관심 있으시면 문자로 자세한 내용 보내드릴게요""",2
"""아, 그런 경우에도 고객님께서 추천해주실 수 있는 분이 계시면 좋겠네요. 간단한 정보 안내 문자 보내드릴게요! 😊 감사합니다""",2
"""아, 그렇군요! 저희 차집사는 최대 7% 수수료 지급 혜택이 있으니, 한 번 고려해보세요. 문자로 더 자세한 정보 보내드릴게요. 감사합니다""",2
"""아니요, 다른 비용은 없습니다. 계약 성사 시 보험료의 7%만 지급되며, 추가 비용 없이 진행됩니다""",2
"""아니요, 가입은 고객님이 직접 진행하셔야 합니다. 저희가 연결해 드리고, 수수료는 익일에 지급됩니다""",2
"""아니에요, 함정 없습니다! 저희는 고객님께 직접 보험가입을 연결해 드리고, 광고비를 지급하는 시스템이에요. 간단하고 투명하게 진행됩니다""",2
"""아니에요, 사기가 아닙니다. 자동차보험 다이렉트 비교견적 서비스를 제공하는 정식 업체입니다. 고객님께 혜택을 드리기 위해 전화 드렸습니다""",2
"""아, 회의 중이시군요! 잠시 후 다시 연락드리겠습니다. 카톡으로 간단한 내용 남겨드릴게요. 감사합니다""",2
"""아, 회의 중이시군요! 그럼 간단히 문자로 안내드릴게요. 감사합니다""",2
"""아, 회의 중이시군요! 그러면 제가 간단한 내용 문자로 보내드릴게요. 필요하실 때 연락 주세요! 감사합니다""",2
"""아, 죄송합니다! 잘못 연결된 것 같아요. 감사합니다""",2
"""아, 이미 가입하셨군요! 저희 차집사도 경쟁력 있는 조건으로 제공하니, 혹시 필요하시면 다시 한 번 연락드릴게요. 문자로 자세한 내용 보내드릴게요. 감사합니다""",2
"""아, 이미 가입하셨군요! 그럼 저희 서비스는 필요 없으실 수도 있지만, 혹시라도 보험 갱신 시기나 변경 필요할 때도 연락 주시면 좋을 것 같습니다. 문자로 혜택 안내 드릴게요! 감사합니다""",2
"""아, 알겠습니다! 간단한 내용을 문자로 보내드릴게요. 필요하실 때 연락주세요! 감사합니다""",2
"""아, 알겠습니다. 회의 후에 연락드리겠습니다. 문자로 간단한 안내 보내드릴게요. 감사합니다""",2
"""아, 알겠습니다. 결정권자와의 상담 후 연락 주시면 감사하겠습니다. 제가 간단한 정보 문자로 보내드릴게요""",2
"""아, 알겠습니다. 간단히 홍보 문구 보내드릴게요. 문자로 자세한 내용 전달해드리겠습니다. 감사합니다""",2
"""아, 알겠습니다. 간단하게 말씀드리면, 자동차보험 비교 견적 서비스 제공하고 있습니다. 필요하실 때 언제든지 연락 주세요! 문자로 정보 보내드릴게요. 감사합니다""",2
"""아, 알겠습니다! 회의 후에 문자로 간단한 정보 보내드릴게요. 감사합니다""",2
"""아, 알겠습니다! 회의 중이시라면 제가 간단한 내용 문자로 보내드리겠습니다. 나중에 확인해보시고 연락 주시면 좋겠습니다""",2
"""아, 알겠습니다! 회의 끝나시면 제가 다시 연락드릴게요. 필요하신 내용 문자로 보내드릴게요. 감사합니다""",2
"""아, 알겠습니다! 회의 끝나고 연락주세요. 감사합니다""",2
"""아, 알겠습니다! 바쁘신 것 같아 간단히 말씀드릴게요. 저희 차집사에서는 고객님들 소개해주시면 최대 7% 수수료 지급해드리고 있습니다. 명함 문자로 보내드릴게요. 연락 주세요""",2
"""아, 알겠습니다! 간단히 문자로 정보 드릴게요. 나중에 편하실 때 연락 주세요. 감사합니다! 😊""",2
"""아, 알겠습니다! 간단히 말씀드리면, 자동차보험 고객 소개 시 광고비를 드리는 제안입니다. 문자로 자세한 내용 보내드릴게요. 감사합니다""",2
"""아, 이미 가입하셨군요! 감사합니다. 😊 그러면 필요하실 때 언제든지 연락주세요. 문자로 간단한 혜택 안내 드릴게요""",2
저희는 보험사 연도대상자 출신으로 팀을 재구성하여 수수료를 높게 책정했습니다. 체결율이 95% 이상이라 많은 딜러분들이 만족하고 계십니다. 더 많은 정보 필요하시면 언제든지 연락 주세요,2
저희는 보험사 연도대상자 출신으로 팀을 재구성하여 고객님들께 더욱 신뢰할 수 있는 서비스를 제공하고 있습니다. 그래서 이번에 수수료를 7%로 설정하게 되었습니다,2
저희는 보험사 연도대상자 출신으로 팀을 재구성하여 고객님들께 더 나은 서비스와 조건을 제공하기 위해 이렇게 좋은 수수료를 마련했습니다. 체결율도 95% 이상이라 많은 분들이 만족하고 계십니다,2
저희는 보험사 연도대상자 출신들로 팀을 재구성하면서 더 나은 조건을 제공하기 위해 수수료를 7%로 설정했습니다. 체결율도 95% 이상으로 많은 분들이 함께 하고 있습니다,2
저희는 다이렉트 자동차보험 비교견적 회사 차집사입니다. 자동차를 판매하실 때 고객을 소개해 주시면 광고비를 지급해드리는 내용입니다,2
저희는 공개된 사업자 정보로 연락드렸습니다. 제 번호 저장하시면 견적 문의 시 빠르게 도움드릴 수 있습니다,2
저희는 공개된 딜러 정보를 바탕으로 연락드리고 있습니다. 궁금하신 점이나 견적 문의가 있으시면 언제든지 연락주세요,2
저희는 고객님이 다이렉트 보험을 통해 직접 저렴한 금액으로 보험료를 절감할 수 있도록 도와드리기 위해 높은 수수료를 지급하고 있습니다. 많은 분들이 만족하고 계세요,2
저희는 고객님에게 더 나은 조건으로 보험 상품을 제공하기 위해 보험사 연도대상자 출신으로 팀을 재구성했습니다. 그래서 이렇게 수수료를 높여드리는 조건을 마련하게 되었습니다,2
견적은 고객님께서 연락 주시면 바로 진행해드릴 수 있습니다. 언제든지 편하게 문의해 주세요,2
저희는 고객님들께 더 나은 서비스를 제공하기 위해 보험사 연도대상자 출신으로 팀을 재구성했습니다. 그래서 경쟁력 있는 **수수료 7%**를 제안하고 있습니다. 고객님들께 더 많은 혜택을 드릴 수 있도록 노력하고 있습니다,2
저희는 **차집사**라는 다이렉트 자동차보험 비교견적 회사입니다,2
저희가 자동차 딜러님 정보를 통해 연락드렸습니다. 제 번호 저장해 두셨다가 견적 문의 있으실 때 연락주시면 빠르게 도와드리겠습니다.,2
저희가 자동차 딜러 관련 정보를 통해 연락드렸습니다. 고객님 도움이 필요하실 때 언제든지 연락주세요,2
저희가 보험사 연도대상자 출신들로 팀을 재구성하면서 수수료를 7%로 설정했습니다. 이로 인해 체결율이 95% 이상으로 높아 많은 분들이 혜택을 누리고 있습니다,2
저희 차집사에서는 고객님이 자동차를 판매할 때 보험 가입 고객을 소개해주시면 최대 7%의 광고비를 지급해드립니다. 관심 있으신가요?,2
저희 상담원 번호는 010-1234-5678입니다. 저장해 두셨다가 필요하실 때 언제든지 연락주세요,2
저는 평일 오전 9시부터 오후 6시까지 언제든지 가능합니다. 편한 시간에 연락 주시면 됩니다! 😊,2
저는 평일 오전 9시부터 오후 6시까지 언제든지 가능합니다. 편하신 시간대에 연락 주시면 되어요,2
저는 평일 오전 9시부터 오후 6시까지 가능합니다. 편하신 시간대에 연락주시면 됩니다,2
저희는 고객님들께 최저가 보험료를 제공하기 위해 직접 판매 방식으로 운영하고 있습니다. 그래서 수수료를 높여서 딜러님들께도 혜택을 드리고 있습니다,2
죄송합니다. 간단한 정보 문자 발송해드리겠습니다. 도움이 필요하시면 언제든지 연락주세요. 감사합니다,2
죄송합니다. 간단하게 문자로 정보 보내드릴게요. 감사합니다,2
죄송합니다. **차집사**는 자동차보험 비교견적 서비스를 제공하고 있습니다. 고객님들 소개해주시면 **수수료**를 지급해드립니다. 더 자세한 내용은 문자로 보내드릴게요.,2
죄송하지만 허가증은 직접 보여드릴 수 없습니다. 대신 저희 서비스에 대해 더 자세히 설명드릴 수 있습니다. 관심 있으신가요?,2
죄송하지만 저희는 허가증이나 등록 정보를 직접 제공해드릴 수 없습니다. 그러나 궁금하신 부분에 대해 자세히 설명드릴 수 있으니 언제든지 문의해 주세요,2
죄송하지만 명함은 따로 제공해드리지 않아요. 대신 **차집사** 전화번호를 알려드릴게요. 1588-xxxx로 연락주시면 됩니다. 감사합니다,2
좋은 소식 감사합니다! 만족하신다니 정말 기쁩니다. 혹시 더 많은 혜택이나 궁금한 점이 있으시면 언제든지 말씀해 주세요! 🚗,2
좋은 선택이세요! 비교견적 요청을 주시면 cu 상품권도 지급해드리겠습니다. 어떤 차량에 대해 비교해보시겠어요,2
좋으신가요? 😊 그럼 구체적인 혜택과 절차 안내해드릴게요. 고객님이 보험을 소개해주시면 **7% 수수료**를 다음날 바로 지급해드립니다. 더 궁금하신 점 있으신가요,2
좋습니다! 비교견적 요청해주시면 **cu 편의점 상품권** 드릴게요. 필요한 정보 말씀해주시면 바로 진행할 수 있습니다,2
저희는 언제든지 연락 가능합니다. 견적 문의가 필요하실 때 편하신 시간에 전화 주시면 빠르게 도와드리겠습니다,2
제가 다음주에 다시 연락 드릴게요. 그때 필요하신 내용 말씀해주시면 빠르게 도와드리겠습니다. 감사합니다,2
제 번호는 010-1234-5678입니다. 저장해 두시면 필요할 때 언제든지 연락주세요!,2
제 번호는 010-1234-5678입니다. 저장해 두셨다가 언제든지 연락 주시면 빠르게 도와드리겠습니다,2
제 번호는 **010-1234-5678**입니다. 저장해 두셨다가 언제든지 연락주시면 빠르게 도와드리겠습니다,2
전화 통화는 약 5분 정도 소요됩니다. 간단하게 설명드리고 궁금하신 점도 답변해드릴게요,2
저희는 차집사에서 전화 드렸습니다. 다이렉트 자동차보험 비교견적 서비스를 제공하고 있습니다,2
저희는 자동차보험 다이렉트 비교견적을 제공하는 **차집사**입니다. 자동차를 판매하실 때 고객을 소개해주시면 광고비를 드리는 제안입니다,2
저희는 자동차보험 다이렉트 비교견적 서비스 제공하는 **차집사**입니다,2
저희는 자동차 딜러님과의 관계를 통해 연락드렸습니다. 제 번호 저장해 두시면 견적 문의 시 빠르게 진행 도와드리겠습니다,2
저희는 자동차 딜러 관련 정보를 바탕으로 연락드렸습니다. 제 번호 저장해 두셨다가 견적 문의 있으실 때 연락주시면 빠르게 도와드리겠습니다,2
제가 드린 번호 저장해 두시면 언제든지 견적 문의 주시면 빠르게 진행 도와드리겠습니다. 필요할 때 편하게 연락 주세요!,2
이번에 새로 만든 팀은 보험사 연도대상자 출신들로 구성된 팀입니다. 전문성을 바탕으로 고객님들에게 더 나은 서비스를 제공하기 위해 노력하고 있습니다,2
이번에 새로 만든 팀은 보험사 연도대상자 출신들로 구성된 팀입니다. 고객님들께 더 좋은 혜택과 서비스를 제공하기 위해 재구성했습니다.,2
이번에 새로 만든 팀은 보험사 연도대상자 출신들로 구성된 팀입니다. 고객님들께 더 나은 서비스를 제공하기 위해 전문성을 높인 팀입니다,2
이번에 새로 만든 팀은 보험사 연도대상자 출신들로 구성된 전문팀입니다. 고객님께 더 나은 서비스를 제공하기 위해 재구성한 팀입니다,2
이번에 만든 팀은 보험사 연도대상자 출신으로 구성된 전문가 팀입니다. 고객님들께 더 나은 서비스를 제공하기 위해 재구성했습니다,2
이번에 만든 팀은 보험사 연도대상자 출신들로 구성된 전문 팀입니다. 고객님께 더 나은 서비스를 제공하고자 노력하고 있습니다,2
이미 가입하셨군요. 그렇다면 현재 보험사와 비교해보실 수 있습니다. 저희는 **수수료 7%** 조건으로 진행하고 있습니다. 문자로 간단한 정보 보내드릴게요. 감사합니다!,2
의뢰하시면 전문 상담원이 **1~2일 내**에 연락드려 견적을 안내해드립니다.,2
원하실 때 언제든지 연락 주시면 됩니다. 제 번호 저장해 두시고 필요하실 때 연락 주세요!,2
저는 차집사 상담원입니다. 고객님께 자동차보험 광고 제안 드리러 전화 드렸습니다,2
온라인으로 진행하시면 간편하게 도와드릴 수 있습니다. 의뢰하시면 전문 상담원이 연락드릴 예정입니다,2
언제든지 편하실 때 전화주시면 됩니다! 저희가 빠르게 진행 도와드리겠습니다. 제 번호 저장해 두시면 좋을 것 같아요,2
언제든지 편하실 때 연락주시면 됩니다! 제가 항상 대기하고 있을게요. 😊,2
언제든지 편하실 때 연락주시면 됩니다! 제가 빠르게 진행 도와드릴게요,2
언제든지 편하실 때 연락 주시면 됩니다. 제가 항상 대기하고 있으니 필요하실 때 말씀해 주세요,2
언제든지 편하실 때 연락 주시면 됩니다! 저희가 빠르게 진행 도와드릴게요. 제 번호 저장해 두시면 좋습니다,2
