response_text,count
계약서는 고객님이 고객 소개를 해주신 후에 처리되면 다음 날 바로 발송해드립니다. 궁금하신 점 있으시면 언제든지 말씀해 주세요!,2
계약서는 고객님께서 소개해 주신 고객이 가입을 완료한 후 바로 발송해드립니다. 궁금하신 점 있으시면 언제든지 말씀해 주세요,2
견적은 고객님이 원하실 때 언제든지 요청하시면 바로 진행해드리겠습니다. 연락주시면 신속하게 도와드릴게요,2
견적은 고객님이 소개해주신 고객이 보험 가입을 하시면 바로 진행됩니다. 다음날에는 광고비도 지급해드려요,2
"""네, 현재 보험이 있어도 가입 가능합니다. 기존 고객님도 저희를 통해 추가 혜택을 받으실 수 있습니다. 궁금한 점이 있으면 언제든지 말씀해 주세요""",2
견적 문의 후 보통 10분 이내에 빠르게 진행됩니다. 필요하신 서류나 정보가 있으면 미리 준비해주시면 좋습니다,2
걱정하지 마세요. 가입이 거절된 고객님도 오프라인으로 진행할 수 있어요. 자세한 내용은 문자로 보내드릴게요. 감사합니다!,2
다이렉트 가입은 사고 이력이 적은 고객님께 가능합니다. 사고건이 많거나 특별한 경우는 오프라인으로 가입할 수 있습니다. 필요하신 조건이나 상세 내용은 언제든지 문의 주세요,2
갱신하셨군요! 혹시 다른 고객님 소개해주시면 광고비 혜택 드릴 수 있습니다. 관심 있으실까요,2
갱신하셨군요! 다음에 고객님이 새로 차량을 구매하실 때 소개해주시면 혜택 안내해드릴게요. 문자로 자세한 내용 보내드릴게요!,2
개인정보는 모르는 상태에서 전화 드렸습니다. 고객님과의 신뢰를 바탕으로 상담 진행하려고 합니다. 궁금하신 점 있으시면 언제든지 말씀해 주세요!,2
감사합니다. 필요하신 정보가 있으시면 언제든지 연락주세요! 문자로도 간단한 내용 보내드릴게요. 감사합니다,2
감사합니다. 좋은 하루 되세요,2
감사합니다! 😊 현재 이용 중이신 업체와 비교해 보시면 좋을 것 같아요. 수수료 7% 조건으로 진행하고 있습니다. 더 궁금한 점 있으시면 언제든지 말씀해 주세요,2
감사합니다! 혹시 더 궁금한 점이나 도움이 필요하시면 언제든지 말씀해 주세요,2
감사합니다! 혹시 궁금한 점이나 필요하신 정보가 있으시면 언제든지 말씀해 주세요. 😊,2
감사합니다! 필요하실 때 언제든지 연락 주시면 빠르게 도와드리겠습니다. 😊,2
감사합니다! 평일 오전 10시부터 오후 5시까지 가능합니다. 편한 시간에 연락 주시면 빠르게 도와드리겠습니다,2
걱정 마세요! 사고가 많으신 고객님도 오프라인으로 가입 가능하니 저희에게 문의해 주시면 도와드릴 수 있습니다. 자세한 내용은 문자로 안내해드릴게요,2
다이렉트 가입은 사고 이력이 많거나 특정 조건이 있을 경우 힘들 수 있습니다. 이럴 경우 오프라인으로 진행하시면 됩니다. 고객님 차량에 따라 다르니 상담해드릴 수 있습니다,2
다이렉트 가입은 사고 건수가 적고 보험 이력이 양호한 경우 가능합니다. 사고가 많으신 분들은 오프라인으로 가입하실 수 있어요,2
다음 주 중에 다시 연락드리겠습니다. 제 번호 저장해 두시면 견적 문의 시 빠르게 진행 도와드리겠습니다. 감사합니다,2
네 맞습니다! 체결율이 95% 이상으로 정말 좋은 조건이에요. 많은 분들이 함께 하고 계시니 꼭 연락주세요,2
네 맞습니다! 소개하신 고객의 보험료의 7%를 딜러님께 지급해드립니다,2
기본적으로 고객 연결 후 1~2일 이내에 광고비 지급됩니다. 더 궁금하신 점 있으신가요,2
기본적으로 고객 소개 시 **최대 7%**의 수수료를 지급해드리고 있습니다. 기존 차량은 **5%**입니다. 더 궁금하신 점 있으신가요,2
그렇군요! 현재 이용 중인 업체가 만족스럽다면 좋습니다. 혹시 나중에 수수료 혜택이나 비교견적이 필요하시면 언제든지 연락주세요. 문자로 간단히 안내해드릴게요! 감사합니다.,2
그렇군요! 결정권자분과도 연락드릴 수 있도록 안내해드리겠습니다. 저희 정보와 혜택을 문자로 보내드릴까요?,2
괜찮습니다. 간단한 정보를 문자로 보내드릴게요. 감사합니다,2
계약서는 고객이 소개해주신 후 진행이 완료되면 다음날 바로 보내드리겠습니다. 필요한 절차는 간단하니 걱정하지 않으셔도 됩니다,2
괜찮습니다! 필요하실 때 언제든지 연락주세요. 간단한 정보 문자로 보내드릴게요. 감사합니다,2
괜찮습니다! 간단한 내용 문자로 보내드릴게요. 감사합니다,2
광고비는 사업소득으로 분류되어 세금 신고 시 포함해야 합니다. 자세한 사항은 회계사와 상담하시는 게 좋습니다. 추가 질문 있으시면 말씀해 주세요,2
고객님이 다이렉트 가입이 가능하시려면 사고 이력이나 보험료 납부 이력이 중요합니다. 사고 건수가 많으면 오프라인으로 가입이 가능하구요. 자세한 내용은 상담을 통해 안내해드리겠습니다,2
고객님의 자동차보험 가입을 위해서는 차량 등록증과 운전면허증이 필요합니다. 추가적인 서류가 필요할 경우 다시 안내드리겠습니다,2
고객님의 번호는 공개된 연락처 목록에서 확인하였습니다. 혹시 불편하셨다면 죄송합니다. 필요하시면 저희 번호를 저장해 두셨다가 견적 문의 주시면 빠르게 도와드리겠습니다,2
고객님의 문의가 들어오면 **최대한 빠르게** 견적을 드리겠습니다. 보통 **1~2일 이내**에 안내해드려요,2
고객님을 소개해주시면 최대 **7%**의 수수료를 지급해드립니다. 기존 차량에 대해서는 **5%**로 진행됩니다,2
고객님께서 제공하신 정보를 바탕으로 연락드렸습니다. 혹시 불편하셨다면 죄송합니다. 제 번호 저장해 두시면 견적 문의 시 빠르게 진행 도와드리겠습니다,2
고객 소개 시 필요한 서류는 고객의 **운전면허증**과 **자동차 등록증**입니다. 추가로 **보험 가입증명서**가 필요할 수 있습니다,2
괜찮습니다! 혹시 나중에라도 필요하시면 언제든지 연락주세요. 감사합니다! 문자로도 간단한 정보 보내드릴게요. 😊,2
알겠습니다! 간단한 정보 문자로 보내드릴게요. 감사합니다,2
알겠습니다! 간단하게 광고 홍보 문구 보내드릴게요. 문자로 자세한 내용 안내해드리겠습니다. 감사합니다,2
안녕하세요~ 통화는 짧게 2~3분 정도 소요됩니다! 필요한 정보만 간단히 안내드릴게요.,2
안녕하세요~ 차집사에서 전화 드렸습니다. 다이렉트 자동차보험 비교견적을 제공하는 회사입니다,2
안녕하세요~ 차집사는 다이렉트 자동차 보험 비교견적을 제공하는 회사입니다. 고객님께 자동차보험을 연결해주시면 광고비를 지급하는 좋은 혜택이 있어요,2
안녕하세요~ 차집사 상담원입니다. 자동차보험 관련 광고 제안 드리려고 전화 드렸습니다. 잠시 말씀드릴까요,2
안녕하세요~ 차집사 상담원입니다. 자동차보험 관련 광고 제안 드리고 있습니다. 고객님께서 보험 가입 시 소개해주시면 수수료를 지급해 드립니다,2
안녕하세요~ 차집사 상담원입니다. 자동차를 판매할 때 고객을 소개해 주시면 광고비를 지급해드리는 프로그램이 있습니다. 관심 있으신가요,2
안녕하세요~ 차집사 상담원입니다. 고객님들 자동차보험을 연결해주시면 **다이렉트 금액**으로 진행하고 최대 **7% 수수료**를 다음날 바로 지급해드립니다,2
소개료는 보험료의 7%를 고객이 가입한 다음날 바로 지급해드립니다.,2
안녕하세요~ 차집사 상담원 김은주입니다. 자동차보험 관련 광고 제안 드리려고 전화 드렸어요,2
안녕하세요~ 차집사 상담원 김은주입니다. 자동차보험 관련 광고 제안 드리러 전화 드렸습니다.,2
안녕하세요~ 차집사 상담원 김은주입니다. 자동차보험 관련 광고 제안 드리러 전화 드렸습니다,2
안녕하세요~ 차집사 상담원 김은주입니다. 자동차보험 관련 광고 제안 드리러 연락드렸습니다,2
안녕하세요~ 차집사 상담원 김은주입니다. 자동차보험 고객을 소개해 주시면 광고비를 드리는 프로그램이 있습니다. 관심 있으신가요,2
안녕하세요~ 차집사 상담원 김은주입니다. 고객님께서 자동차보험 관련하여 광고 제안을 드리려고 전화드렸습니다. 잠시 시간 괜찮으신가요,2
안녕하세요~ 차집사 상담원 김은주입니다. 고객님께 광고 제안 드리려고 연락드렸습니다. 자동차 보험을 연결해주시면 광고비를 제공해드려요. 관심 있으신가요?,2
안녕하세요~ 차집사 상담원 김은주입니다! 지금 잠시 괜찮으신가요,2
안녕하세요~ 차집사 상담원 김은주입니다! 자동차보험 관련해서 좋은 제안 드리려고 전화드렸습니다. 잠시 시간 괜찮으신가요,2
안녕하세요~ 차집사 김은주입니다. 다이렉트 자동차보험 연결해주시면 최대 7% 광고비를 다음날 바로 지급해드립니다. 관심 있으신가요?,2
안녕하세요~ 차집사 상담원 김은주입니다. 자동차보험을 판매할 때 고객을 소개해주시면 **최대 7% 광고비**를 제공해드려요. 관심 있으신가요,2
앞으로 딜러님 담당은 제가 할 예정입니다. 제가 차집사에서 도와드리겠습니다,2
앞으로 딜러님 담당은 제가 할 거라 인사차 연락드렸습니다. 필요한 사항 있으면 언제든지 말씀해 주세요,2
앞으로 딜러님 담당은 제가 할 거라 인사차 연락드렸습니다. 필요하실 때 언제든지 말씀해 주세요!,2
앞으로 딜러님 담당은 제가 할 거라 인사차 연락드렸습니다. 필요하신 경우 언제든지 연락주세요,2
앞으로 딜러님 담당은 제가 할 거라 인사차 연락드렸습니다. 궁금하신 점 언제든지 문의해 주세요,2
알겠습니다. 필요할 때 연락드리겠습니다. 감사합니다,2
알겠습니다. 연락 중단해드리겠습니다. 감사합니다,2
알겠습니다. 연락 중단 요청해주셔서 감사합니다. 필요한 경우 언제든지 연락 주시면 됩니다. 좋은 하루 되세요,2
알겠습니다. 연락 드리지 않겠습니다. 문자로 간단한 정보 보내드릴게요. 감사합니다,2
알겠습니다. 상담이 끝나시면 다시 연락 주시면 감사하겠습니다. 좋은 하루 되세요,2
알겠습니다! 간단히 광고 문구 문자로 보내드릴게요. 감사합니다,2
알겠습니다. 관심 가져주셔서 감사합니다. 혹시 필요하시면 언제든지 연락주세요. 좋은 하루 되세요,2
알겠습니다. 관심 가져주셔서 감사합니다. 나중에 필요하시면 언제든지 연락주세요. 좋은 하루 보내세요,2
알겠습니다. 간단히 안내해 드릴게요. 저희 차집사는 고객님께서 보험 가입 시 혜택이 많습니다. 필요하시면 문자로 명함 보내드릴게요. 감사합니다,2
알겠습니다. 간단하게 홍보 문구 보내드릴게요. 감사합니다,2
알겠습니다. 간단하게 홍보 메시지 보내드리겠습니다. 감사합니다,2
알겠습니다! 회의 후에 편하실 때 연락 주시면 감사하겠습니다. 좋은 회의 되세요,2
알겠습니다! 필요하실 때 언제든지 전화 주시면 됩니다. 감사합니다,2
알겠습니다! 상담이 끝나시면 언제든지 연락주세요. 저희 전문 상담원이 상세히 안내해드리겠습니다. 감사합니다,2
알겠습니다! 상담 중이시군요. 필요하신 정보나 도움이 필요하시면 언제든지 말씀해 주세요. 감사합니다,2
알겠습니다! 관심이 없으시다면 간단히 홍보 문구 드릴게요. 문자로 자세한 내용 보내드리겠습니다. 감사합니다,2
알겠습니다. 관심 없으시다니 아쉽네요. 관련 내용 문자로 보내드릴게요. 감사합니다!,2
아 그렇군요! 현재 가입하신 곳보다 더 좋은 조건을 제안할 수 있습니다. 혹시 나중에라도 비교해보실 생각이 있으시면 문자로 간단한 정보 보내드릴게요. 감사합니다,2
신뢰할 수 있는 다이렉트 자동차보험 비교견적 서비스입니다. 고객님께서 소개해 주신 분에게 혜택을 드리는 내용입니다. 궁금하시면 자세히 설명해드릴게요,2
신고하신다구요? 어떤 부분이 불편하셨는지 알려주시면 감사하겠습니다. 도움이 필요하시면 언제든지 말씀해 주세요,2
숨겨진 비용은 전혀 없습니다. 고객님께 드리는 금액은 보험료의 7%와 상품권 5천원입니다. 추가 비용 걱정 없이 안심하고 이용하실 수 있습니다,2
수수료는 최대 7%입니다. 기존 차량은 5% 지급해드리고 있습니다. 추가 질문 있으시면 말씀해 주세요,2
수수료는 익일 오후에 바로 지급해드립니다. 증빙 발급은 요청하시면 가능합니다. 필요하시면 말씀해 주세요,2
수수료는 익일 오후에 바로 지급해드리고 있습니다. 증빙 발급도 가능합니다. 필요하시면 말씀해 주세요,2
수수료는 익일 오후에 바로 지급됩니다. 증빙 발급도 가능하니 필요하시면 말씀해 주세요,2
수수료는 성사 시 최대 7%를 익일에 지급해드립니다,2
수수료는 성사 시 익일에 지급해드립니다,2
안녕하세요~ 저는 차집사 상담원입니다. 차은하 팀장은 아닙니다. 제가 자동차보험 광고 제안 드리려고 연락드렸어요. 잠깐 말씀드려도 될까요,2
수수료는 고객님이 소개해주신 보험 가입 금액의 **최대 7%**를 지급해드립니다. 기존 차량은 **5%** 지급되구요. 더 궁금하신 점 있으시면 말씀해 주세요,2
소개해 주신 고객이 보험 가입하는 데 보통 10분 정도 소요됩니다. 추가 궁금한 점 있으시면 말씀해 주세요,2
소개해 주신 고객이 보험 가입 완료 후 **다음 날 바로** 수수료 지급해드립니다,2
소개료로 지급되는 금액은 세금이 포함된 금액입니다. 따라서 별도로 세금 처리는 필요 없습니다. 추가 궁금한 점 있으시면 말씀해 주세요,2
소개료로 지급되는 금액은 **세금이 포함된 금액**으로 지급됩니다. 자세한 내용은 언제든지 문의해 주세요,2
소개료로 지급되는 금액에 대해 세금은 발생할 수 있습니다. 자세한 내용은 세무사와 상담하시는 것이 좋습니다. 추가 질문 있으시면 언제든지 문의해 주세요,2
소개료로 보험료의 **7%**를 딜러님께 지급해드리기 때문입니다. 다른 조건들도 있으니 궁금하신 점 있으면 언제든지 말씀해 주세요,2
소개료로 보험료의 **7%**를 드립니다.,2
소개료는 수익으로 간주되어 세금 신고를 하셔야 합니다. 세금 처리에 대한 구체적인 내용은 세무사와 상담하시길 권장합니다. 추가 궁금한 사항이 있으시면 말씀해 주세요,2
소개료는 세금이 포함된 금액으로 지급됩니다. 수수료에 대한 세금 처리는 딜러님께서 직접 신고하셔야 합니다. 더 궁금하신 점이 있으시면 말씀해 주세요,2
수수료는 다음날 바로 지급됩니다,2
안녕하세요~ 저는 차집사 상담원입니다. 자동차보험 관련 광고 제안을 드리려고 전화 드렸습니다,2
안녕하세요~ 저는 차집사 상담원입니다. 자동차를 판매하실 때 고객을 소개해 주시면 광고비를 드리는 제안입니다,2
안녕하세요~ 저는 차집사 상담원 김은주입니다,2
안녕하세요~ 자동차보험 비교견적을 제공하는 차집사입니다. 고객님들이 보험 가입 시 저희를 소개해 주시면 광고비를 드리는 내용입니다. 관심 있으신가요?,2
안녕하세요~ 000팀장님! 저는 다이렉트 자동차보험 차집사 김은주입니다. 간단히 광고 제안 드리고 싶습니다. 고객님이 보험을 연결해주시면 **수수료 최대 7%**를 드립니다,2
안녕하세요~ 000팀장님! 자동차보험을 연결해주시면 수수료를 지급해드리는 프로그램을 소개하고 싶습니다. 관심 있으신가요,2
안녕하세요~ 000팀장님! 다이렉트 자동차보험 비교견적을 제공하는 차집사입니다. 고객님들께서 자동차보험 가입 시 소개해주시면 광고비를 지급해드리는 혜택이 있습니다. 관심 있으신가요,2
안녕하세요. 차집사입니다. 다이렉트 자동차보험 비교견적 서비스를 제공하고 있습니다,2
안녕하세요. 저는 차집사 다이렉트 상담원입니다. 자동차보험 비교견적을 제공하는 회사입니다,2
안녕하세요. 저는 **차집사** 다이렉트 상담원입니다. 자동차보험 비교견적 서비스를 제공하고 있습니다,2
아니에요! 저희는 믿을 수 있는 다이렉트 자동차보험 비교견적 서비스입니다. 좀 더 자세한 내용은 문자로 보내드릴게요. 확인해보세요!,2
안녕하세요! 차집사 상담원입니다. 자동차보험을 연결해주시면 최대 7% 광고비를 다음날 바로 지급해드립니다. 관심 있으시면 더 자세히 안내해드릴게요,2
안녕하세요! 차집사 다이렉트 차은하 팀장입니다. 잠시 통화 가능하신가요,2
안녕하세요! 차집사 다이렉트 차은하 상담원입니다. 어떻게 도와드릴까요?,2
안녕하세요! 차집사 김은주입니다. 자동차보험 연결해주시면 광고비로 최대 7% 지급해드려요. 관심 있으신가요,2
안녕하세요! 저는 차집사의 차수연 상담원입니다. 자동차보험 관련 좋은 제안 드리려고 연락드렸어요. 잠시 이야기 나눌 수 있을까요,2
안녕하세요! 저는 차집사 상담원입니다. 자동차보험 비교 가입을 도와드리고 있어요. 잠시 통화 가능하신가요,2
안녕하세요! 저는 차집사 상담원입니다. 자동차보험 비교 가입에 대해 간단히 안내 드리려고 전화 드렸습니다. 잠시 통화 가능하신가요,2
안녕하세요! 저는 차집사 상담원입니다. 자동차 보험 관련하여 간단한 제안 드리려고 전화드렸습니다. 잠시 통화 가능하신가요,2
안녕하세요! 간단한 상담이라면 5분 정도 소요될 수 있습니다. 필요하신 내용은 문자로도 안내해드릴 수 있어요,2
아주 간단하게 1-2분 정도만 소요됩니다. 잠시 시간 괜찮으신가요,2
안녕하세요! 차집사의 차은하 팀장입니다. 어떻게 도와드릴까요,2
"""네, 맞습니다! 사고가 많아도 오프라인으로 가입이 가능하며, 최대 **10%의 수수료**를 지급해드립니다. 관심 있으시면 언제든지 문의해 주세요""",2
"""네, 맞습니다! 사고가 많거나 다이렉트 가입이 어려운 고객님들도 오프라인으로 가입하실 수 있습니다. 이 경우 **최대 10%의 수수료**를 지급해드립니다. 더 궁금한 점 있으시면 말씀해 주세요!""",2
"""네, 맞습니다! 다이렉트 가입이 어려운 고객님은 오프라인으로도 가입 가능하며, 이 경우 최대 **10% 수수료**를 지급해드립니다""",2
"""네, 맞습니다! 다이렉트 가입이 어려운 고객님은 오프라인으로도 가입 가능하며, 이 경우 수수료는 **10% 지급**해드립니다""",2
"""네, 맞습니다! 다이렉트 가입이 어려운 고객님은 오프라인으로도 가입 가능하며, 이 경우 **수수료는 10%**로 지급해드립니다""",2
"""네, 맞습니다! 고객을 소개해 주시면 보험료의 **7%**를 광고비로 지급해드립니다""",2
"""네, 맞습니다! 고객님이 소개해주신 자동차보험 가입자에게 혜택을 드리고, 광고비를 지급해드려요. 자세한 내용 안내해드릴까요""",2
"""네, 맞습니다! 고객님이 소개해주신 분이 보험 가입 후 다음날 바로 계좌로 입금해드립니다""",2
"""네, 맞습니다! 고객님이 소개해주신 고객이 가입하면 현금으로 최대 7%의 수수료를 다음날 바로 지급해드립니다""",2
"""네, 맞습니다! 고객님을 소개해주시면 보험료의 **7%**를 수수료로 지급해드립니다.""",2
"""네, 현재 가입하신 업체가 있으시군요. 저희 차집사도 좋은 조건으로 제공하고 있으니, 필요하실 때 언제든지 연락주세요. 문자로 추가 정보 보내드릴게요! 감사합니다!""",2
"""네, 맞습니다! 고객님들을 소개해 주시면 최대 7%의 광고비를 다음날 바로 지급해드립니다""",2
"""네, 맞습니다! 고객님께서 소개해 주신 보험 가입이 이루어지면, 광고비는 다음날 계좌로 바로 입금해드립니다. 관심 있으신가요""",2
"""네, 맞습니다! 고객님 소개 시 수수료는 **다음날 바로 계좌로 입금**해드립니다. 궁금한 점 있으시면 언제든지 문의 주세요""",2
"""네, 맞습니다! 고객 소개 후 수수료는 다음날 바로 계좌로 입금해드립니다. 추가 질문 있으시면 언제든지 말씀해 주세요""",2
"""네, 말씀해주셔서 감사합니다. 가족과 상의하신 후에 연락 주셔도 됩니다. 제가 문자로 더 자세한 정보 보내드릴게요. 😊""",2
"""네, 말씀하신 대로 가족과 상의해보세요. 필요하시면 더 자세한 정보 문자로 보내드릴게요. 감사합니다""",2
"""네, 많은 분들이 이용하시고 체결율도 95% 이상입니다. 함께 하시면 좋은 혜택 많이 누리실 수 있습니다""",2
"""네, 많은 분들이 이용하시고 계십니다. 체결율이 95% 이상이라 신뢰할 수 있는 서비스입니다. 함께 하시면 좋을 것 같습니다""",2
"""네, 많은 딜러님들이 저희 서비스를 이용하시고 긍정적인 후기를 주셨습니다. 예를 들어, 한 딜러님은 고객 소개로 빠른 수익을 얻으셨고, 또 다른 분은 광고비를 통해 추가 판매를 촉진할 수 있었다고 하셨습니다. 필요하시면 더 구체적인 사례를 문자로 보내드릴게요! 📱""",2
"""네, 많은 딜러님들이 저희 서비스를 이용하고 계십니다. 특히 수수료가 7%로 경쟁력이 있어 많은 분들이 긍정적으로 반응하고 있습니다. 더 궁금하신 점 있으시면 말씀해 주세요""",2
"""네, 맞습니다! 고객님을 소개해주시면 광고비를 지급해드립니다. 관심 있으신가요?""",2
"""네, 명함 내용 문자로 남겨드릴게요. 감사합니다""",2
"""네, 명함 내용 문자로 남겨드릴게요! 감사합니다""",2
"""네, 맞아요! 고객님이 자동차보험을 소개해 주시면 광고비를 드리면서 혜택이 많습니다. 궁금하신 점 있으신가요""",2
"""네, 맞습니다. 차집사는 금융감독원에 등록된 업체입니다. 안정적으로 서비스를 제공하고 있습니다. 추가 질문 있으신가요""",2
"""네, 맞습니다. 수수료는 고객님의 계좌로 익일 오후에 바로 입금해드립니다""",2
"""네, 맞습니다. 소개해주신 고객이 계약을 완료하면 **다음날 바로 계좌로 입금**해드려요. 추가 문의 있으시면 언제든지 말씀해 주세요""",2
"""네, 맞습니다. 소개해 주신 고객이 보험 가입 시, 수수료는 **다음날 바로 계좌로 입금**해드립니다.""",2
"""네, 맞습니다. 다이렉트는 간단한 절차로 진행되며, 고객님께서 필요한 정보만 제공하시면 됩니다. 문자로 자세한 내용 보내드릴게요""",2
"""네, 맞습니다. 고객님 소개 후 수수료는 **계좌로 바로 입금**해드립니다""",2
"""네, 맞습니다! 차집사는 다이렉트 자동차보험 비교견적 서비스를 제공하는 회사입니다. 고객님이 판매한 차량에 대해 보험 가입을 연결해주시면 광고비를 드리는 프로그램이 있습니다. 관심 있으신가요""",2
"""네, 맞습니다! 사고가 많으신 고객님들도 오프라인으로 가입하실 수 있습니다. 이 경우 최대 **10% 수수료**를 지급해드립니다. 추가 궁금한 점 있으시면 언제든지 말씀해 주세요""",2
"""네, 맞습니다! 온라인으로 다이렉트 가입시 7% 수수료를 지급해드리고, 사고가 많아 다이렉트 가입이 안되는 고객님은 오프라인으로도 가입이 가능하여 10% 수수료를 지급해드립니다""",2
"""네, 맞습니다! 온라인 다이렉트 가입은 7% 수수료를 익일에 지급해드리고, 사고가 많아 다이렉트 가입이 안 되는 고객님은 오프라인으로 가입하실 수 있어요. 이 경우에는 10% 수수료를 지급해드립니다""",2
"""네, 맞습니다! 오프라인으로 진행하시면 **10% 수수료**를 지급해드립니다. 자세한 내용은 카톡으로 다시 안내해드릴게요. 😊""",2
"""네, 맞습니다! 수수료는 최대 7%로, 성사 시 익일 지급해드립니다""",2
