response_text,count
"네, 기존 거래처 있으시군요. 혹시 비교견적만 받아보시고 결정하셔도 됩니다.",32
알겠습니다. 혹시 조건 확인해보시고 싶으시면 언제든 연락 주세요.,27
이해합니다. 그래도 한 번 비교만 받아보시는 건 어떠세요? 수수료 7%와 높은 체결율이 강점입니다.,26
"네, 이해합니다. 명함만 남겨드릴게요. 비교 필요하실 때 연락 주세요.",25
"안녕하세요, 차집사 다이렉트입니다. 보험료 비교 안내 간단히 드려도 될까요?",22
"네, 안녕하세요. 차집사 다이렉트 상담원입니다.",21
"안녕하세요, 자동차 보험 비교·가입 도와드리는 차집사 다이렉트입니다. 잠시 통화 가능하실까요?",19
소개 수수료는 7%이며 지급 시점은 익일 오후입니다. 원하시면 지금 비교 견적 접수해 드릴까요?,18
저희 차집사는 인슈넷 FC 제휴사로 여러 보험사와 연계해 최적의 자동차보험료를 찾아드립니다.,17
AI ARS 1668-4007 번호로 가입 고객의 보험사에 직접 연결되며 긴급출동 안내도 가능합니다.,15
"현재 조건은 7%이며, 지급은 익일 오후로 안내드립니다.",15
"저희는 비교견적부터 가입까지 한 번에 도와드리며, 가입 후에는 AI ARS 1668-4007로 고객님을 보험사에 직접 연결해드립니다.",13
"네, 지금 바쁘시군요. 언제 다시 연락드리면 좋을까요?",13
"수수료 7%, 익일 오후 지급입니다. 등록하신 계좌로 이체해 드립니다.",12
"네, 수수료는 건당 7%입니다. 정산은 보통 익일 오후에 입금됩니다.",12
알겠습니다. 자료와 담당자 연락처를 카톡으로 전달드리겠습니다.,12
정확한 안내를 위해 궁금하신 점을 조금만 더 구체적으로 알려주실 수 있을까요?,12
"차집사 다이렉트는 40년 전통의 인슈넷 FC 자회사로, 정식 등록된 보험 비교 서비스입니다.",10
죄송합니다. 제가 정확히 이해하지 못했어요. 한 번만 더 말씀해 주시겠어요?,10
"네, 명함과 자세한 자료를 지금 문자로 보내드리겠습니다. 검토 후 연락 주세요.",10
혹시 담당자와 직접 통화하시겠어요? 더 자세히 안내드릴 수 있습니다.,10
전담 상담원이 배정되어 청약까지 끝까지 도와드립니다. 필요한 서류는 문자로 안내드립니다.,9
견적은 보통 10분 내에 안내드리며 기존 보험과의 비교도 가능합니다.,9
알겠습니다. 명함만 문자로 남겨드릴게요. 필요하실 때 연락 주세요.,8
"네, 바쁘실 텐데 방해 드려 죄송합니다. 명함만 남겨둘게요.",8
"어떤 부분이 가장 궁금하신가요? 수수료, 절차, 서비스 중에서 알려드릴까요?",8
감사합니다! 좋은 하루 되세요.,8
"네, 감사합니다. 필요하시면 언제든 연락 주세요. 좋은 하루 보내세요!",7
"고객님께 별도 연락이 가지 않도록 AI로 처리하며, 필요시 보험사와 직접 연결해드립니다.",7
알겠습니다. 편하신 시간에 다시 연락드려도 될까요?,7
감사합니다. 담당자 연결해서 빠르게 안내드리겠습니다.,7
좋습니다! 비교 견적 바로 진행하고 결과를 문자로 보내드리겠습니다.,5
"네, 이해했습니다. 좋은 하루 되세요.",5
"""저희는 최대 7%의 수수료를 지급하며, 체결율이 95% 이상으로 높은 편입니다. 많은 딜러님들이 함께 하고 계신 점이 차별점입니다. 추가로, 삼성과 제휴되어 있어 더 많은 혜택을 제공합니다""",2
"""저희는 최대 7%의 수수료를 제공하고 있습니다. 다른 조건은 현재로서는 없지만, 많은 분들이 함께하고 계셔서 체결율도 95% 이상입니다. 관심 있으시면 언제든지 문의 주세요""",2
"""저희는 자동차보험 비교견적 서비스 제공업체로, 허가증이나 등록 정보는 보유하고 있지 않습니다. 대신, 실질적인 보험 견적을 통해 고객님께 도움을 드릴 수 있습니다. 필요하시면 언제든지 문의 주세요""",2
"""저희는 자동차를 구매하시는 고객님들을 위해 보험을 연결해드리고, 그에 따른 광고비를 지급하는 제도입니다. 고객님이 소개해주시면 혜택을 드리는 내용이에요""",2
"""저희는 보험사 연도대상자 출신으로 팀을 재구성하여 고객님께 더 나은 서비스를 제공하고, 합리적인 수수료로 혜택을 드리기 위해 이런 조건을 마련했습니다""",2
"""저희는 보험사 연도대상자 출신들로 팀을 재구성하여, 고객님께 더 나은 서비스를 제공하고자 합니다. 그래서 경쟁력 있는 **수수료 7%**와 높은 체결율 95% 이상으로 진행하고 있습니다.""",2
"""저희는 고객에게 다이렉트 보험료를 제공하며, 이를 통해 딜러님께 소개료로 7%를 지급하는 구조입니다. 고객이 직접 가입하는 만큼 비용 절감이 가능해 제휴 조건으로 설정하였습니다. 더 궁금하신 점 있으신가요""",2
"""저희는 고객님들께 더 나은 보험료를 제공하기 위해 직접 비교 견적을 통해 수수료를 높게 설정하고 있습니다. 또한, 많은 분들이 함께 하고 계셔서 체결율도 95% 이상입니다!""",2
"""저희가 보험사 연도대상자 출신들로 팀을 재구성해서 더 좋은 서비스를 제공하고 있습니다. 그래서 수수료를 7%로 설정하고, 체결율도 95% 이상으로 높여 많은 분들이 믿고 함께 하고 계십니다""",2
"""저희 차집사는 여러 보험사를 비교하여 **가장 저렴한 가격**으로 제공해드리고, 고객님이 소개해주신 분께는 **최대 7%의 수수료**를 다음날 바로 지급해드립니다. 다른 곳과는 차별화된 **빠른 지급**과 **다양한 제휴**가 있습니다""",2
"""안녕하세요, 저는 자동차보험 다이렉트 비교견적 회사 **차집사**의 상담원입니다. 고객님들에게 자동차보험을 소개해 주시면 광고비를 지급하는 내용을 안내드리려고 연락드렸습니다""",2
"""조건은 고객을 소개해 주시면 **수수료는 최대 7%** 지급해드리며, 체결율은 95% 이상입니다. 고객이 다이렉트로 가입하시면 다음날 바로 지급해드립니다""",2
"""죄송합니다! 차집사는 자동차보험 비교견적 서비스를 제공하고, 고객님들 소개 시 광고비를 지급합니다. 관심 있으시면 자세히 안내해드릴 수 있습니다""",2
"""죄송하지만, 현재는 허가증이나 등록 정보에 대한 조회가 불가능합니다. 다만, 필요하신 사항이 있으시면 언제든지 문의해 주세요""",2
"""죄송하지만, 허가증이나 등록 정보는 저희가 직접 제공할 수 없습니다. 하지만 궁금하신 부분이 있다면 다른 문의사항으로 도와드리겠습니다""",2
"""죄송하지만, 허가증이나 등록 정보는 저희가 직접 제공할 수 없습니다. 대신 더 궁금하신 점이나 필요하신 정보가 있다면 말씀해 주세요""",2
"""죄송하지만, 허가증이나 등록 정보는 공유할 수 없습니다. 대신 저희의 서비스나 혜택에 대한 궁금한 점은 언제든지 문의해 주세요""",2
"""안녕하세요, 저는 인슈넷 에프씨 자회사 차집사 다이렉트 상담원입니다""",2
"""죄송하지만, 허가증은 직접 보여드릴 수 없습니다. 저희 차집사는 정식 등록된 회사로, 고객님께 신뢰를 드리기 위해 노력하고 있습니다. 더 궁금하신 점 있으면 말씀해 주세요""",2
"""죄송하지만, 허가증은 직접 보여드릴 수 없습니다. 대신 저희 서비스에 대한 설명과 혜택을 안내해드릴 수 있습니다. 필요하신 정보가 있으시면 말씀해 주세요""",2
"""죄송하지만, 허가증 관련 정보는 제공해드릴 수 없습니다. 대신 자동차보험 관련하여 궁금한 점이 있으시면 도와드리겠습니다""",2
"""죄송하지만, 저희는 허가증이나 등록 정보를 직접 보여드릴 수는 없습니다. 대신, 자세한 정보나 궁금한 사항이 있으시면 언제든지 문의해 주세요""",2
"""좋습니다! 비교견적 요청해주시면 cu 상품권도 지급해드리고, 최저가로 보험 견적을 받아보실 수 있습니다. 어떤 차량인지 알려주시면 바로 진행해드릴게요!""",2
"""죄송하지만 직접 명함을 드리긴 어렵고, 연락처는 1:1 채팅으로 보내드리겠습니다. 추가로 궁금한 점이 있으시면 언제든지 문의해주세요""",2
"""죄송하지만 전화번호나 개인 연락처는 제공해드릴 수 없습니다. 대신, 의뢰를 주시면 전문 상담원이 연락드릴 예정입니다. 많은 관심 부탁드립니다""",2
"""죄송하지만 네, 감사합니다""",2
"""죄송하지만 개인 연락처는 제공이 어렵습니다. 대신, 저희 차집사에 견적 문의 주시면 언제든지 빠르게 도와드리겠습니다""",2
"""좋으세요? 그럼 구체적인 혜택과 절차를 안내해드릴게요. 고객님이 자동차를 판매할 때 저희에게 고객을 소개해 주시면, 최대 **7%의 광고비**를 다음날 바로 지급해드립니다. 어떻게 진행할까요""",2
"""저희 차집사는 다이렉트 보험으로 최저가를 제공하며, 고객님 소개 시 **최대 7%의 광고비**를 지원합니다. 또한, 다양한 제휴사와 협력해 더 많은 혜택을 드리고 있습니다""",2
"""좋습니다! 비교견적 요청 주시면 **cu 상품권**도 지급해드리고, 최적의 보험 상품을 안내해드리겠습니다. 어떤 차량에 대해 비교 원하시나요""",2
"""좋습니다! 그럼 구체적인 혜택과 절차를 안내해드리겠습니다. 고객님이 자동차를 판매하실 때 저희에게 고객을 소개해주시면 수수료를 지급해드리며, 체결율도 95% 이상이라 많은 분들이 함께하고 계세요. 어떻게 진행하실지 말씀해 주시면 도와드리겠습니다""",2
"""좋습니다! 그러면 고객님께서 자동차보험을 소개해 주시면, 성사 시 7%를 익일에 지급해드릴 수 있습니다. 궁금하신 점 있으시면 말씀해 주세요""",2
"""조건은 고객을 소개해주시면, 다이렉트 금액으로 진행해드리며 수수료는 최대 7%, 기존 차량은 5% 지급됩니다. 체결율도 95% 이상으로 많은 분들이 함께하고 있습니다""",2
"""죄송하지만, 그 부분에 대한 정보는 제공해드릴 수 없습니다. 대신 자동차보험 관련 문의나 견적이 필요하시면 언제든지 연락 주시면 도와드리겠습니다""",2
"""안녕하세요, 차집사입니다. 다이렉트 자동차보험 비교견적 서비스를 제공하고 있습니다""",2
"""안녕하세요, 차집사입니다. 고객님이 자동차를 판매할 때 보험 가입 고객을 소개해 주시면 최대 7% 광고비를 지급해드립니다. 관심 있으시면 더 자세히 안내해드릴게요!""",2
"""안녕하세요, 차집사에서 전화드렸습니다. 다이렉트 자동차보험 비교견적 서비스 제공하고 있습니다""",2
"""안녕하세요, 차집사에서 연락드렸습니다. 다이렉트 자동차보험 비교견적 서비스를 제공하고 있습니다""",2
"""안녕하세요, 차집사 상담원입니다. 자동차보험 고객을 소개해주시면 광고비를 지급해드리는 제안입니다. 관심 있으신가요""",2
"""안녕하세요, 차집사 상담원입니다. 자동차보험 고객 소개 시 최대 7% 광고비를 지급해드립니다. 관심 있으시면 자세히 안내해드리겠습니다!""",2
"""안녕하세요, 차집사 상담원입니다. 자동차를 판매할 때 고객을 소개해 주시면 최대 7% 광고비를 드립니다. 관심 있으시면 자세히 안내해드릴게요""",2
"""안녕하세요, 차집사 상담원입니다. 자동차 보험 관련 광고 제안 드리려고 연락드렸습니다. 고객님이 보험을 소개해주시면 광고비를 드리는 내용입니다. 관심 있으신가요""",2
"""안녕하세요, 차집사 상담원입니다. 수상한 부분이 있다면 말씀해 주시면 자세히 설명드리겠습니다. 저희는 신뢰할 수 있는 다이렉트 보험 서비스를 제공하고 있습니다.""",2
"""이해합니다. 😅 하지만 저희는 믿을 수 있는 서비스입니다. 고객님께서 소개해주신 분이 보험 가입 시 혜택을 드리고, 수수료도 지급됩니다. 더 궁금하시면 문자로 정보 보내드릴게요""",2
"""안녕하세요, 차집사 상담원입니다. 고객님이 자동차를 판매할 때 보험을 소개해주시면 최대 7%의 수수료를 다음날 지급해드립니다. 관심 있으신가요""",2
"""안녕하세요, 차집사 상담원입니다. 고객님이 자동차 보험을 소개해 주시면 최대 7% 광고비를 지급해드려요. 관심 있으시면 자세히 안내해드리겠습니다""",2
"""안녕하세요, 차집사 상담원입니다. 고객님들 자동차보험을 소개해주시면 **최대 7% 수수료**를 드리고, 다음날 지급해드립니다. 자세히 안내해드릴까요""",2
"""안녕하세요, 저는 차집사 상담원 김은주입니다. 앞으로 제가 담당이니 필요하실 때 언제든지 연락 주세요""",2
"""안녕하세요, 차집사 상담원입니다. 고객님들 자동차보험을 소개해 주시면 최대 7% 광고비를 드립니다. 추가로 자세한 내용 문자로 보내드릴게요""",2
"""안녕하세요, 차집사 상담원 김은주입니다. 저는 상담원으로 고객님을 도와드리고 있습니다. 추가 문의가 있으시면 언제든지 말씀해 주세요""",2
"""안녕하세요, 차집사 상담원 김은주입니다. 7%는 광고비로 자동차보험료의 7%를 딜러님께 지급해드리는 제안입니다. 고객을 소개해주시면 수익을 더 높일 수 있는 기회입니다""",2
"""안녕하세요, 차집사 다이렉트 상담원입니다. 자동차보험 비교견적 서비스를 제공하는 회사입니다""",2
"""안녕하세요, 저는 차집사의 상담원입니다. 자동차를 판매할 때 고객을 소개해주시면 광고비를 지급하는 내용 안내드리고 있습니다. 조금 더 자세히 설명드릴까요""",2
"""안녕하세요, 차집사 상담원입니다. 수상하게 느끼셨다면 죄송합니다. 저희는 자동차보험 다이렉트 비교견적 서비스를 제공하며, 고객 소개 시 광고비를 드리는 내용입니다. 더 궁금하신 점 있으시면 말씀해 주세요""",2
"""저희 차집사는 다양한 보험사와 제휴되어 있어 최저가 비교가 가능합니다. 또한, 고객님께서 소개해 주신 고객이 가입하시면 광고비를 지급해드리는 혜택이 있습니다.""",2
"""자동차보험 관련 광고 제안입니다. 고객님이 자동차 판매 시 저희에게 소개해주시면, 광고비를 지급해드립니다. 추가로 궁금한 점 있으시면 말씀해 주세요""",2
"""자동차 보험을 판매할 때 고객을 소개해주시면, **최대 7%의 광고비**를 지급해드리는 내용입니다. 추가적인 정보 필요하시면 말씀해 주세요""",2
"""이해해주셔서 감사드립니다. 저희는 신뢰할 수 있는 다이렉트 자동차보험 비교견적 서비스입니다. 간단한 소개로 광고비 지급이 가능하니, 필요하시면 언제든지 문의 주세요! 💌""",2
"""이해합니다! 간단히 말씀드리면, 고객님들 보험 연결 시 광고비를 드립니다. 더 궁금하신 내용은 문자로 안내해드릴게요. 감사합니다!""",2
"""안녕하세요, 저는 자동차보험 다이렉트 비교견적 회사 **차집사**의 상담원입니다. 자동차보험 관련 제안을 드리기 위해 연락드렸습니다""",2
"""이번에 재구성한 팀은 보험사 연도대상자 출신으로, 더 나은 혜택과 서비스를 제공하기 위해 구성되었습니다. 고객님들께 더 유리한 조건으로 다이렉트 자동차보험 견적을 안내해드릴 수 있습니다""",2
"""의뢰하시면 전문 상담원이 빠르게 연락드릴 예정입니다. 견적은 보통 1~2일 내에 처리되며, 계약도 신속하게 진행됩니다. 많은 관심 부탁드립니다""",2
"""안녕하세요, 저는 자동차보험 비교견적을 제공하는 차집사의 상담원입니다. 고객님께 자동차보험 연결 시 광고비를 드리는 제안을 드리고자 연락드렸습니다""",2
"""안녕하세요, 팀장님! 다이렉트 자동차보험 비교견적을 제공하는 차집사 김은주입니다. 고객님들이 자동차보험을 가입하실 때 소개해 주시면 광고비를 드리는 제안이 있어 연락드렸습니다. 관심 있으신가요""",2
"""우리는 고객님들께 더 나은 보험료를 제공하고, 딜러님께는 높은 수수료로 보답하여 서로 윈-윈하는 구조를 만들기 위해서입니다. 많은 분들이 혜택을 누리고 계십니다""",2
"""안녕하세요, 저는 차집사 다이렉트 상담원입니다. 자동차보험 비교견적 서비스를 제공하고 있습니다""",2
"""안녕하세요, 저는 차집사 다이렉트 상담원입니다. 자동차보험 비교견적 서비스를 제공하는 회사입니다""",2
"""안녕하세요, 저는 차집사 상담원 김은주입니다. 감사합니다! ✨""",2
"""안녕하세요, 저는 차집사 상담원 김은주입니다. 앞으로 딜러님 담당은 제가 할 예정입니다. 감사합니다""",2
"""온라인으로 진행하시면 더 간편하게 혜택을 받으실 수 있습니다. 고객님께서 자동차보험을 연결해주시면, 모든 과정이 온라인으로 이루어집니다""",2
"""어 네, 감사합니다""",2
"""안녕하세요, 현재 자동차보험료는 차량 정보와 운전자의 이력에 따라 달라지기 때문에, 정확한 금액을 알려드리려면 상담이 필요합니다. 저희 전문 상담원이 신속하고 정확하게 안내해드릴 수 있으니 언제든지 문의 주세요""",2
"""안녕하세요, 팀장님! 차집사 김은주입니다. 자동차보험 관련 광고 제안 드리려고 했습니다. 고객님들 연결해 주시면 최대 7%의 수수료를 다음날 바로 지급해드립니다. 관심 있으신가요""",2
"""안녕하세요, 팀장님! 차집사 김은주입니다. 다이렉트 자동차보험 관련 광고 제안 드리려고 전화 드렸습니다. 고객님들 소개해 주시면 최대 7%의 수수료를 다음날 바로 지급해드려요""",2
"""음 네, 감사합니다""",2
감사합니다! 궁금한 점 있으시면 언제든지 말씀해 주세요. 좋은 하루 되세요,2
감사합니다! 고객님들 자동차보험을 소개해주시면 **최대 7% 수수료**를 다음날 바로 지급해드립니다. 자세한 내용 궁금하시면 말씀해 주세요,2
감사합니다! 고객님도 좋은 하루 되세요,2
감사합니다! 고객님께서 소개해 주신 고객이 자동차보험에 가입하시면 최대 7%의 광고비를 다음날 바로 지급해드립니다. 추가로 궁금하신 내용 있으신가요,2
감사합니다! 고객님께서 만족하신다니 기쁩니다. 혹시 주변에 소개해 주실분이 있으시면 언제든지 연락 주세요!,2
간단히 홍보 문구 드릴게요. 차집사와 함께하면 많은 혜택이 있습니다! 제가 명함 문자로 보내드릴게요~ 감사합니다!,2
간단하게 안내드릴게요. 차집사와 제휴하시면 고객님께 광고비 지급 가능합니다. 문자로 자세한 내용 보내드릴게요. 감사합니다!,2
간단하게 문자로 정보 보내드릴게요. 감사합니다,2
간단하게 말씀드릴게요. 고객님께서 보험을 소개해주시면 최대 7%의 수수료를 드립니다. 자세한 내용 문자로 보내드릴게요. 감사합니다,2
"""죄송합니다, 불편을 드려서 정말 죄송합니다. 간단한 정보 문자 보내드릴게요. 감사합니다""",2
가입 조건은 간단합니다. 고객님이 판매하는 차량에 대해 저희에게 소개해 주시면 됩니다. 체결율이 95% 이상이라 많은 딜러분들이 함께하고 계세요. 추가로 궁금하신 점 있으신가요,2
가입 조건은 간단합니다! 고객님이 자동차를 판매할 때 저희에게 소개해 주시면 됩니다. 그러면 **수수료 최대 7%**를 지급해드려요. 추가로 궁금한 점 있으시면 말씀해 주세요,2
가입 가능 여부는 차량의 사고 이력에 따라 다릅니다. 사고가 많으신 경우에도 오프라인으로 가입이 가능합니다. 더 궁금한 점 있으시면 말씀해 주세요,2
가입 가능 여부는 차량 상태나 사고 이력에 따라 다릅니다. 사고가 많아 다이렉트 가입이 어려운 고객님은 오프라인으로 가입 가능하니 걱정하지 않으셔도 됩니다! 추가 문의사항 있으면 언제든지 연락 주세요,2
가입 가능 여부는 고객님의 사고 이력에 따라 다릅니다. 사고가 많으신 고객님은 오프라인으로 가입이 가능하니 걱정하지 않으셔도 됩니다. 추가 문의는 언제든 환영입니다,2
가입 가능 여부는 고객님의 사고 이력에 따라 다릅니다. 사고가 많으신 경우에는 오프라인으로도 가입이 가능하니 걱정하지 마세요. 추가 문의 사항이 있으시면 언제든지 연락 주세요,2
가입 가능 여부는 고객님의 사고 이력에 따라 다릅니다. 사고가 많으신 경우 오프라인으로 가입 가능하니 걱정 마세요. 더 궁금한 점 있으시면 언제든지 연락 주세요,2
★ 감사합니다! 고객님도 좋은 하루 되세요. 필요하신 점 있으시면 언제든지 연락주세요,2
7%는 저희 차집사에서 제공하는 기본 소개료입니다. 고객님을 소개해 주시면 보험료의 7%를 지급해드립니다.,2
7%는 자동차보험 수수료 시장에서 경쟁력 있는 비율로 설정된 것입니다. 고객님께 적절한 혜택을 드리면서도 딜러님께도 매력적인 수익을 제공하기 위해 정해진 비율입니다. 추가 질문 있으시면 언제든지 말씀해 주세요,2
가입하신 보험사로 직접 연결도 도와드릴 수 있습니다. 필요하시면 언제든지 말씀해 주세요! 도움이 필요하시면 문자로도 추가 안내 드릴게요. 감사합니다,2
감사합니다! 추가로 궁금한 점이나 필요하신 사항이 있으시면 언제든지 말씀해 주세요,2
감사합니다! 추가로 궁금한 점이나 도움이 필요하시면 언제든지 말씀해 주세요,2
감사합니다! 추가로 궁금한 점이 있으시면 언제든지 말씀해 주세요. 문자로도 자세한 정보를 보내드릴게요,2
감사합니다! 추가로 궁금하신 사항이 있으시면 언제든지 말씀해 주세요,2
감사합니다! 추가 질문이나 도움이 필요하시면 언제든지 말씀해 주세요. 😊,2
감사합니다! 추가 문의사항 있으시면 언제든지 연락주세요. 문자로도 자세한 내용 보내드리겠습니다,2
감사합니다! 좋은 하루 되세요. 😊,2
감사합니다! 좋은 하루 되세요. 필요하시면 언제든지 연락 주시기 바랍니다,2
감사합니다! 제 번호 저장해 두셨다가 견적 문의 있으실 때 언제든지 연락 주시면 빠르게 도와드리겠습니다. 😊,2
감사합니다! 저희는 자동차를 판매할 때 고객을 소개해주시면 **광고비**를 드리는 프로그램을 운영하고 있습니다. 관심 있으신가요,2
감사합니다! 더 궁금한 사항이나 필요하신 정보가 있으면 언제든지 말씀해 주세요. 😊,2
감사합니다! 자세한 혜택이나 절차 안내 필요하시면 언제든지 말씀해 주세요. 😊,2
감사합니다! 자세한 내용은 문자로 보내드릴게요. 필요하시면 언제든지 연락주세요,2
감사합니다! 연락 주시면 전문 상담원들이 자세히 안내해드릴게요. 좋은 하루 되세요,2
감사합니다! 연락 주시면 자세히 안내해드리겠습니다. 좋은 하루 되세요,2
감사합니다! 언제든지 연락 주시면 안내해드리겠습니다. 좋은 하루 되세요! 🌟,2
감사합니다! 언제든지 문의 주시면 자세히 안내해드리겠습니다. 좋은 하루 되세요!,2
감사합니다! 언제든지 궁금한 점 있으시면 연락 주세요. 좋은 하루 되세요!,2
감사합니다! 만족하신다니 기쁘네요. 😊 혹시 주변에 필요한 분이 계시면 언제든지 소개해주시면 좋습니다. 문자로 간단한 정보 보내드릴게요,2
감사합니다! 더 궁금한 점이 있으시면 언제든지 말씀해 주세요. 😊,2
감사합니다! 더 궁금한 점 있으면 언제든지 연락주세요. 좋은 하루 되세요,2
감사합니다! 저희는 자동차를 판매할 때 고객을 소개해 주시면 **최대 7%**의 광고비를 지급해 드립니다. 소개해 주신 고객이 가입하시면 **다음날 바로 지급**됩니다. 궁금한 점 있으신가요,2
"""처리 시간은 보통 1~2일 이내에 진행되며, 빠르게 진행해드리겠습니다. 필요하신 경우 언제든지 연락주세요""",2
"""차집사에서 자동차보험을 판매하실 때 고객을 소개해 주시면, **최대 7%의 광고비**를 드리는 프로그램입니다. 더 궁금하신 점이 있으시면 말씀해 주세요""",2
