response_text,count
"""고객님이 자동차를 판매하실 때 저희에게 고객을 소개해 주시면, 보험 가입이 완료된 후 수수료를 지급해드립니다. 단순히 소개만 해주시면 되고, 자세한 절차는 카톡으로 안내드릴게요. 😊""",2
"""네, 감사합니다! 고객님이 자동차를 판매할 때 저희 차집사에 고객을 소개해주시면, 광고비로 최대 7%를 다음날 바로 지급해드립니다. 삼성과 제휴되어 있고, 영업용 차량도 5% 지급됩니다. 자세한 절차나 혜택이 궁금하시면 언제든지 문의주세요""",2
"""고객님이 실제로 내야 하는 금액은 보험료에 따라 다릅니다. 하지만 보험료 비교견적만 해주셔도 **cu 모바일 상품권 5천원**을 드리고, 계약이 성사되면 보험료의 **7%**를 지급해드립니다.""",2
"""고객님이 소개해주신 고객이 보험 가입 시 최대 7%의 광고비를 다음날 바로 지급해드립니다. 또, 자동차보험 견적 의뢰만 주셔도 cu 상품권을 드려요""",2
"""고객님이 내야 하는 금액은 다이렉트 보험료에 따라 달라지지만, 저희가 제안드리는 조건은 계약 성사 시 보험료의 **7%**를 지급해드리니, 자세한 금액은 고객님의 차량 정보에 따라 안내해드릴 수 있습니다""",2
"""고객님이 내셔야 하는 금액은 보험료에 따라 다르지만, 저희가 제공하는 견적을 통해 비교 후 가장 적합한 금액을 선택하실 수 있습니다. 상담 후 계약 성사 시 보험료의 **7%**를 광고비로 지급해드립니다""",2
"""고객님이 내셔야 하는 금액은 보험료에 따라 다르지만, 저희가 비교견적을 통해 최적의 금액을 찾아드릴 수 있습니다. 견적 의뢰만 주셔도 **cu 모바일 상품권 5천원** 드리고, 계약 성사 시 **보험료의 7%**를 지급해드립니다""",2
"""고객님이 고객을 소개해주시면, 보험 가입 후 최대 7%의 수수료를 다음날 지급해드립니다. 간단하게 고객 정보를 저희에게 전달해주시면 됩니다""",2
"""고객님의 개인정보는 저희 시스템에서 안전하게 관리되고 있으며, 통화 연결을 위해 필요한 최소한의 정보만 사용하고 있습니다. 궁금하신 점이 있으시면 언제든지 말씀해 주세요""",2
"""고객님들이 자동차보험 가입 시, 소개해주시면 최대 7%의 광고비를 다음날 바로 지급해드리는 내용입니다. 추가적인 혜택도 있습니다""",2
"""고객님들께 자동차보험을 소개해 주시면 수수료를 지급하는 광고 제안입니다. 최대 7%의 수수료를 다음날 바로 지급해드리며, 삼성과도 제휴되어 있습니다. 추가로 견적 의뢰 시 상품권도 드립니다.""",2
"""고객님께서 자동차보험을 소개해주시면 최대 **7%의 수수료**를 지급해드리며, **다음날 바로 지급**됩니다. 추가로 **cu 상품권**도 드립니다!""",2
"""고객님이 자동차를 구매할 때 저희에게 소개해 주시면, 보험 가입 후 최대 **7%의 수수료**를 다음 날 바로 지급해드립니다. 절차는 간단합니다. 고객님 정보를 저희에게 알려주시면 됩니다""",2
"""네, 감사합니다! 고객님이 자동차를 구매하실 때, 저희 차집사에 고객을 소개해주시면 광고비를 지급해 드립니다. 다이렉트 가입 시 최대 7% 수수료를 다음 날 바로 지급해 드리고, 영업용 차량도 5% 지급합니다. 많은 관심 부탁드립니다""",2
"""네, 감사합니다! 고객님이 자동차를 구매하실 때 저희에게 소개해주시면, 보험 가입 후 최대 7%의 광고비를 지급해드립니다. 가입 절차는 간단하고, 수수료는 다음날 바로 지급됩니다. 추가로 궁금한 점 있으시면 언제든지 말씀해 주세요""",2
"""네, 감사합니다! 고객님이 소개해 주신 분이 자동차보험을 가입하면, 최대 7%의 수수료를 다음날 바로 지급해드립니다. 삼성과 제휴되어 있어 더 믿을 수 있습니다. 추가 질문 있으시면 말씀해 주세요""",2
"""네, 감사합니다! 고객님도 좋은 하루 되세요""",2
"""네, 간단히 안내해드릴게요. 자동차보험 고객 소개 시 **최대 7% 광고비** 지급해드립니다. 문자로 더 자세한 내용 보내드릴게요. 감사합니다""",2
"""네, 간단히 말씀드리자면, 고객님이 자동차를 판매하실 때 저희에게 고객을 소개해주시면 최대 7%의 광고비를 다음날 지급해드립니다. 도움이 필요하시면 언제든지 말씀해 주세요""",2
"""네, 간단히 말씀드리면, 고객님이 자동차보험을 소개해주시면 최대 7%의 광고비를 다음날 바로 지급해드립니다""",2
"""네, 간단히 말씀드리면, 고객님이 자동차를 판매할 때 보험을 소개해주시면 최대 7%의 광고비를 다음날 지급해드립니다. 관심 있으시면 자세한 내용 안내해드릴게요""",2
"""네, 간단히 다시 말씀드릴게요. 자동차보험을 판매할 때 고객을 소개해주시면 최대 7%의 광고비를 드리는 제안입니다""",2
"""네, 간단하게 안내해드리겠습니다. 고객님께서 자동차보험을 연결해 주시면 수수료를 지급해 드리는 혜택이 있습니다. 더 자세한 내용은 문자로 보내드릴게요! 💌""",2
"""기존 차량은 최대 7% 수수료를 드리고, 영업용 차량은 5% 지급됩니다. 다이렉트 가입이 어려운 고객님은 오프라인으로 진행 시 10% 지급해드립니다""",2
"""네, 가족과 상의해보세요. 관심 있으시면 언제든지 연락 주시면 상세히 안내해드릴게요. 문자로 정보도 보내드릴게요! 감사합니다.""",2
"""네, 가족과 상의하신 후에 언제든지 연락주시면 됩니다. 추가로 궁금한 점이나 필요하신 내용 있으면 말씀해 주세요. 감사합니다""",2
"""네, 가족과 상의하시는 건 좋은 방법입니다. 필요하신 정보나 궁금한 점이 있으시면 언제든지 연락 주세요. 문자로도 간단히 안내드릴 수 있습니다. 감사합니다""",2
"""네, 가족과 상의하시는 거 좋은 결정입니다. 필요하시면 더 궁금한 점 문자로 보내드릴게요. 감사합니다""",2
"""네, 가입은 바로 진행 가능하며, 수수료는 익일 오후에 바로 지급됩니다. 추가로 가입 고객님 보험사로 직접 연결도 해드려요""",2
"""네, 가입은 간단하게 진행됩니다. 고객님이 소개해주신 분이 보험에 가입하시면, 익일 오후에 바로 수수료를 지급해드립니다""",2
"""네, 가입 후 익일 오후에 수수료 7%를 바로 지급해드립니다. 고객님의 보험사로도 직접 연결해드립니다.""",2
"""네, 가입 거절이 있으신 고객님들도 오프라인으로 가입 가능하게 도와드립니다. 걱정하지 마세요""",2
"""네, 가입 가능 여부는 고객님 차량 정보에 따라 다릅니다. 기본적으로 모든 차량이 가입 가능하지만, 특정 조건이 있을 수 있습니다. 차량 정보를 알려주시면 더 자세히 안내해드릴게요""",2
"""네, 가능합니다! 이메일 주소 알려주시면 자료 보내드리겠습니다""",2
"""네, 7%는 저희 차집사에서 제공하는 소개료로, 고객님들이 다이렉트 자동차보험을 통해 보험료를 절약할 수 있도록 도와드리고 있습니다. 이 비율은 시장에서 경쟁력을 유지하기 위해 설정된 것입니다. 더 궁금하신 점 있으시면 말씀해 주세요""",2
"""네, 가족분과 상의하신 후에 연락 주셔도 괜찮습니다. 간단한 내용 문자로 보내드릴게요. 감사합니다""",2
"""네, 저희 차집사 홈페이지 있습니다. 검색창에 """"차집사""""라고 입력하시면 쉽게 찾으실 수 있습니다""",2
"""네, 저는 차집사 상담원 김은주입니다. 앞으로 딜러님의 담당은 제가 맡게 됩니다. 감사합니다""",2
"""네, 저는 차집사 상담원 김은주입니다. 앞으로 딜러님 담당은 제가 할 예정입니다""",2
"""네, 저는 차집사 상담원 김은주입니다. 앞으로 담당하겠습니다""",2
"""네, 자료를 이메일로 보내드릴 수 있습니다. 이메일 주소 말씀해 주시면 바로 전송해드리겠습니다""",2
"""네, 자료를 이메일로 보내드리겠습니다. 이메일 주소를 말씀해 주시면 바로 보내드릴게요""",2
"""네, 자동차보험을 통해 다양한 보장을 받을 수 있습니다. 고객님이 소개해 주신 고객이 보험 가입하면, 보장과 함께 광고비도 지급됩니다. 궁금한 점 있으시면 말씀해 주세요""",2
"""네, 자동차보험을 연결해주시면 최대 7%의 광고비를 다음날 지급해드립니다. 관심 있으시면 자세히 안내해드릴게요""",2
"""네, 자동차보험 고객을 소개해 주시면 최대 **7%의 광고비**를 다음날 지급해드립니다. 관심 있으신가요""",2
"""네, 자동차보험 고객 소개해 주시면 최대 7%의 수수료를 다음날 바로 지급해드립니다. 관심 있으신가요""",2
"""네, 실제 이용 후기에는 많은 딜러분들이 만족하며 수수료를 받고 있다는 내용이 많습니다. 한 딜러님은 고객 소개 후 빠른 지급을 경험하셨고, 또 다른 분은 광고비로 추가 수익을 올리셨다고 말씀하셨어요. 더 궁금하신 점 있으면 말씀해 주세요""",2
"""네, 자동차를 판매할 때 고객을 소개해 주시면, 보험 가입 시 최대 7%의 광고비를 지급해드립니다. 소개하신 고객이 보험 가입을 완료하면, 다음날 바로 지급됩니다. 추가로 궁금하신 점 있으시면 말씀해 주세요""",2
"""네, 자동차 판매 시 고객 소개해주시면 최대 7% 광고비를 지급해드립니다. 관심 있으시면 자세히 안내해드릴게요""",2
"""네, 자동차 보험 견적만 의뢰해주셔도 됩니다. 그럼 **cu모바일 5천원권**도 드리니 많은 참여 부탁드립니다!""",2
"""네, 자동차 보험 견적만 의뢰해주셔도 **cu 모바일 5천원권**을 드립니다. 많은 소개 부탁드립니다""",2
"""네, 이해했습니다. 바쁘신 시간에 연락드려서 죄송합니다. 간단한 정보 문자 드릴게요. 감사합니다""",2
"""네, 이해했습니다! 오늘 문자 보내드릴게요. 궁금하신 점 있으시면 언제든지 연락 주세요! 감사합니다""",2
"""네, 이해합니다. 회의 후에 연락주시면 자세히 말씀드리겠습니다. 문자로 간단한 내용도 보내드릴게요. 감사합니다""",2
"""네, 이해합니다. 현재 계약이 끝난 후에도 저희와 함께하실 수 있습니다. 관련 정보는 문자로 보내드릴게요. 감사합니다""",2
"""네, 이해합니다. 하지만 저희는 **다이렉트 금액**으로 바로 지급해드리니 한번 확인해보세요. 문자를 보내드릴게요! 감사합니다""",2
"""네, 이해합니다. 필요하실 때 언제든지 연락 주세요. 간단한 홍보 문구와 함께 문자 보내드리겠습니다. 감사합니다""",2
"""네, 자동차보험 고객 소개 시 최대 7%의 광고비를 지급해드립니다. 관심 있으시면 더 자세히 안내해드릴게요""",2
"""네, 저희 차집사는 정식 등록된 업체입니다. 보험사 연도대상자 출신으로 팀을 재구성하여 신뢰할 수 있는 서비스를 제공하고 있습니다. 추가 질문 있으시면 말씀해 주세요""",2
"""네, 저희 차집사는 정식 등록된 다이렉트 자동차보험 비교견적 업체입니다. 신뢰할 수 있는 서비스 제공을 위해 노력하고 있습니다. 추가 궁금하신 점 있으시면 말씀해 주세요""",2
"""네, 저희 차집사는 정식 등록된 다이렉트 보험 비교견적 회사입니다. 보험사 연도대상자 출신으로 팀을 재구성하여 신뢰성을 높였습니다. 궁금하신 점 있으시면 언제든지 말씀해 주세요!""",2
"""네, 저희 차집사는 정식 다이렉트 보험 비교견적 회사입니다. 보험사 연도대상자 출신들로 팀을 재구성하여 신뢰할 수 있는 서비스를 제공하고 있습니다. 추가 궁금한 점 있으시면 언제든지 말씀해 주세요""",2
"""네, 저희 차집사는 여러 보험사와 제휴를 맺고 있어 신뢰할 수 있습니다. 많은 딜러님들이 이용하시고 있으니 믿으셔도 됩니다""",2
"""네, 저희 차집사는 여러 보험사와 제휴되어 있으며, 신뢰할 수 있는 서비스를 제공하고 있습니다. 많은 딜러님들이 이용하고 계세요. 궁금한 점 있으시면 언제든지 말씀해 주세요!""",2
"""네, 저희 차집사는 신뢰할 수 있는 다이렉트 자동차보험 비교견적 회사로 많은 딜러님들과 협력하고 있습니다. 고객님들께 최상의 서비스를 제공하고 있습니다. 궁금하신 점 있으시면 언제든지 문의해 주세요""",2
"""네, 저희 차집사는 신뢰할 수 있는 다이렉트 보험 비교견적 회사입니다. 많은 딜러님들이 저희와 함께하고 있습니다. 자세한 내용 말씀드릴까요""",2
"""네, 저희 차집사는 삼성과 제휴된 신뢰할 수 있는 회사입니다. 성사 시 **익일 지급**을 보장해드리니 안심하셔도 됩니다""",2
"""네, 저희 차집사는 삼성과 제휴되어 있으며, 보험사 연도대상자 출신들로 팀을 구성해 신뢰도를 높였습니다. 고객님들께 안전하고 편리한 서비스를 제공하고 있습니다""",2
"""네, 저희 차집사 홈페이지 있습니다. 다양한 보험 비교 견적을 확인하실 수 있습니다. 방문해 보세요""",2
"""네, 저희 차집사는 믿을 수 있는 다이렉트 자동차보험 비교견적 서비스입니다. 삼성과 제휴되어 있으며, 많은 딜러님들이 이용하고 있습니다. 추가 문의 있으시면 언제든지 말씀해 주세요""",2
"""네, 저희 차집사는 다이렉트 자동차보험 비교에 특화된 검증된 업체입니다. 많은 고객님들이 이용하고 계세요""",2
"""네, 저희 차집사는 다수의 보험사와 제휴되어 있어 믿을 수 있는 서비스입니다. 고객님들에게 최적의 보험료를 제공해드리고 있습니다""",2
"""네, 저희 차집사는 금융감독원에 등록된 업체입니다. 안전하고 신뢰할 수 있는 서비스를 제공하고 있습니다. 추가로 궁금한 점 있으시면 말씀해 주세요""",2
"""네, 저희 차집사는 금융감독원에 등록된 업체입니다. 안전하고 신뢰할 수 있는 서비스 제공을 위해 최선을 다하고 있습니다.""",2
"""네, 저희 차집사는 금융감독원에 등록된 업체입니다. 안전하게 이용하실 수 있습니다""",2
"""네, 저희 차집사는 금융감독원에 등록된 업체입니다. 신뢰할 수 있는 서비스 제공을 위해 최선을 다하고 있습니다. 추가로 궁금한 사항 있으시면 말씀해 주세요""",2
"""네, 저희 차집사는 고객님이 보험에 가입하실 경우, 필요한 보장을 제공해드립니다. 궁금하신 부분이 있으면 언제든지 문의 주세요""",2
"""네, 저희 차집사는 검증된 회사로 많은 딜러님들이 신뢰하고 이용하고 있습니다. 체결율도 95% 이상이니 안심하고 함께 하실 수 있습니다""",2
"""네, 저희 차집사는 **95% 이상의 체결율**을 자랑하는 신뢰받는 업체입니다. 많은 딜러님들이 함께하고 계시니 안심하셔도 됩니다""",2
"""네, 저희 차집사 홈페이지는 있습니다. 주소는 www.chajibsa.com입니다. 자세한 내용은 홈페이지에서 확인해보실 수 있습니다.""",2
"""네, 저희 차집사는 보험사 연도대상자 출신으로 구성된 팀입니다. 신뢰할 수 있는 서비스를 제공하고 있습니다""",2
"""네, 연락 중단 요청 접수했습니다. 감사합니다""",2
"""네, 연락 주시면 언제든지 도와드리겠습니다! 😊 카톡으로도 내용을 보내드릴게요. 감사합니다""",2
"""네, 여보세요! 자동차보험 다이렉트 비교견적 안내드리려고 연락드렸습니다. 잠시 시간 괜찮으신가요""",2
"""네, 언제든지 편하실 때 연락주세요! 제 번호 저장해두시면 빠르게 도와드리겠습니다. 감사합니다""",2
"""네, 언제든지 편하실 때 연락 주시면 되세요! 제 번호 저장해 두시면 좋을 것 같습니다. 감사합니다""",2
"""네, 언제든지 편하실 때 문의주세요. 필요하실 때 저희가 도움드리겠습니다! 문자로 정보 보내드리겠습니다. 감사합니다""",2
"""네, 언제든지 연락주세요! 카톡으로 간단한 내용 보내드릴게요. 감사합니다""",2
"""네, 언제든지 연락 주시면 됩니다. 필요하실 때 편하게 말씀해 주세요! 카톡으로 내용도 다시 남겨드릴게요. 😊""",2
"""네, 언제든지 연락 주시면 됩니다! 카톡으로도 내용을 보내드릴게요. 감사합니다""",2
"""네, 언제든지 연락 주셔도 됩니다. 카톡으로 내용 보내드릴게요. 감사합니다""",2
"""네, 이해합니다. 카톡으로 간단한 내용 보내드릴게요. 필요하실 때 연락주세요! 감사합니다""",2
"""네, 어떤 점이 궁금하신가요? 자세히 안내해드리겠습니다.""",2
"""네, 어떤 부분이 궁금하신가요? 추가로 설명해드리겠습니다""",2
"""네, 어떤 부분이 궁금하신가요? 자세히 설명해드릴게요""",2
"""네, 어떤 부분이 궁금하신가요? 말씀해 주시면 자세히 안내해드리겠습니다""",2
"""네, 어떤 궁금증이 있으신가요? 말씀해 주시면 자세히 안내해 드리겠습니다""",2
"""네, 알겠습니다. 😊 간단히 홍보 정보 문자로 보내드릴게요. 감사합니다""",2
"""네, 알겠습니다. 회의 끝나시면 다시 연락주시면 됩니다. 감사합니다!""",2
"""네, 알겠습니다. 혹시 필요하신 정보가 있으면 언제든지 연락주세요. 혜택 관련 문자 발송해드릴게요! 감사합니다.""",2
"""네, 알겠습니다. 혹시 필요하시면 언제든지 연락 주세요! 감사합니다""",2
"""네, 알겠습니다. 혹시 더 궁금한 점 있으시면 언제든지 연락주세요. 문자로 간단한 정보 보내드리겠습니다. 감사합니다""",2
"""네, 어떤 점이 궁금하신가요? 😊""",2
"""네, 이해합니다. 저희는 믿을 수 있는 다이렉트 자동차보험 비교견적 서비스입니다. 수수료 조건과 체결율이 높아 많은 딜러님들이 함께 하고 있습니다. 궁금한 점 있으시면 문자로 더 자세한 내용 드리겠습니다""",2
"""네, 이해합니다. 상의 후 연락 주시면 감사하겠습니다. 간단한 내용 문자로 보내드릴게요""",2
"""네, 이해합니다. 사고가 많으신 경우, 오프라인으로 가입 가능하니 걱정하지 않으셔도 됩니다. 추가 문의는 언제든지 연락 주세요! 감사합니다""",2
"""네, 이해합니다. 결정권자와 연락 가능하시면 제가 간단한 내용 문자로 보내드릴게요. 감사합니다""",2
"""네, 이해합니다. 간단히 홍보 문구 알려드릴게요. 문자로도 정보를 보내드릴게요. 감사합니다""",2
"""네, 이해합니다. 간단히 말씀드리면, 고객님들 자동차보험을 연결해주시면 광고비를 지급해드립니다. 더 자세한 내용은 문자로 보내드릴게요. 감사합니다""",2
"""네, 이해합니다. 간단히 말씀드리면, 고객님들 소개해주시면 광고비 지원해드립니다. 문자로 자세한 내용 보내드릴게요. 안전운전하세요""",2
"""네, 이해합니다. 간단한 홍보 문구 보내드릴게요. 문자로 확인해 주세요. 감사합니다!""",2
"""네, 이해합니다. 간단하게 안내 드릴게요. 고객님들 자동차보험을 소개해 주시면 최대 7% 수수료를 다음날 지급해드립니다. 자세한 내용은 문자로 보내드릴게요. 감사합니다""",2
"""네, 이해합니다! 카톡으로 자세한 내용 보내드릴게요. 언제든지 편하실 때 연락주세요! 감사합니다""",2
"""네, 연락처와 명함은 문자로 보내드릴게요. 잠시만 기다려 주세요""",2
"""네, 이메일로 자료 보내드릴 수 있습니다. 이메일 주소 알려주시면 바로 보내드릴게요""",2
"""네, 이메일로 자료 보내드릴 수 있습니다. 이메일 주소 알려주시면 바로 발송해드리겠습니다""",2
"""네, 이메일로 자료 보내드릴 수 있습니다. 고객님의 이메일 주소를 알려주시면 바로 발송해드리겠습니다""",2
"""네, 운전 중이시군요. 간단히 말씀드리면, 고객님이 차량을 판매하실 때 보험 가입을 저희에게 연결해주시면 광고비를 드립니다. 문자로 자세한 내용을 보내드릴게요! 안전 운전하세요""",2
"""네, 온라인은 다이렉트로 가입하시면 7% 수수료를 익일 오후에 지급해드리고, 오프라인은 사고가 많아 다이렉트 가입이 어려운 고객님도 가입 가능하시면 10% 수수료를 드립니다""",2
"""네, 온라인/오프라인 모두 가능합니다! 온라인으로는 **7% 수수료**를 제공하고, 오프라인으로는 **10% 지급**해드립니다. 추가 문의 있으시면 언제든지 말씀해 주세요""",2
"""네, 온라인 다이렉트 가입이 안되는 고객님은 오프라인으로도 가입이 가능합니다. 오프라인 가입 시 **수수료는 10%**로 지급해드리니 많은 활용 부탁드립니다""",2
"""네, 온라인 다이렉트 가입은 모두 가능하고, 사고가 많으신 고객님은 오프라인으로도 가입할 수 있습니다. 오프라인 가입 시에는 수수료가 10% 지급됩니다""",2
"""네, 오프라인으로도 가입 가능합니다. 사고건이 많으신 고객님들도 오프라인으로 가입하실 수 있으며, 최대 **10% 수수료를 지급**해드립니다. 추가 문의 있으시면 언제든지 말씀해 주세요""",2
"""네, 오프라인 가입도 가능합니다. 사고가 많으신 고객님들은 오프라인으로 가입하시면 더 좋은 조건으로 진행해드릴 수 있습니다. 추가적인 정보 필요하시면 언제든지 문의주세요""",2
"""네, 오프라인 가입도 가능합니다. 사고 건이 많으신 고객님께도 오프라인으로 진행해드릴 수 있습니다. 필요하시면 언제든지 문의주세요""",2
"""네, 이해합니다! 계약 기간이 끝난 후에도 저희 차집사와 함께 하실 수 있으니, 언제든지 연락 주시면 좋습니다. 문자로도 자세한 내용 안내드릴게요. 감사합니다""",2
"""네, 차집사는 많은 고객님과 딜러님들께 신뢰를 받고 있습니다. 삼성과 제휴되어 있고, 광고비 지급도 확실히 진행됩니다""",2
"""네, 차집사는 다이렉트 자동차보험 비교견적 전문 회사입니다. 고객님들께 최적의 보험료를 제공해드리고 있습니다.""",2
"""네, 차집사는 다이렉트 자동차보험 비교견적 전문 회사입니다. 고객님께서 보험 가입을 도와드리고, 추천해주시면 광고비도 제공해드립니다""",2
"""네, 차집사는 다이렉트 자동차보험 비교견적 서비스입니다. 고객님께 더 저렴하고 유리한 보험 상품을 제공해드려요""",2
"""네, 차집사는 금융감독원에 등록된 정식 업체입니다. 안전하고 신뢰할 수 있는 서비스를 제공하고 있습니다""",2
"""네, 차집사는 금융감독원에 등록된 업체입니다. 안전하고 믿을 수 있는 서비스를 제공하고 있습니다""",2
"""네, 차집사는 금융감독원에 등록된 업체입니다. 안전하고 믿을 수 있는 서비스 제공하고 있습니다. 추가 궁금한 사항 있으신가요""",2
"""네, 차집사는 금융감독원에 등록된 업체입니다. 안전하게 보험 상품을 제공하고 있습니다. 더 궁금하신 점 있으신가요""",2
"""네, 차집사는 검증된 다이렉트 자동차보험 비교견적 회사입니다. 삼성과 제휴되어 있고, 많은 고객님들이 이용하고 있습니다""",2
"""네, 차집사 홈페이지는 있습니다. 검색창에 """"차집사""""를 입력하시면 쉽게 찾아보실 수 있습니다. 추가 궁금한 점 있으시면 말씀해 주세요""",2
"""네, 저희 차집사는 정식 등록된 업체입니다. 보험업계에서 신뢰를 받고 있는 회사이니 안심하고 문의 주셔도 됩니다""",2
"""네, 제가 명함과 함께 자세한 내용을 문자로 보내드릴게요. 확인 부탁드립니다""",2
"""네, 제가 간단히 말씀드릴게요. 고객님들을 자동차보험에 연결해주시면 최대 7%의 수수료를 다음날 지급해드립니다. 관심 있으신가요""",2
"""네, 제 번호는 010-xxxx-xxxx입니다. 저장해 두시면 언제든지 견적 문의 주시면 빠르게 도와드리겠습니다""",2
"""네, 제 번호는 010-xxxx-xxxx입니다. 저장해 두시고 언제든지 연락주시면 빠르게 도와드리겠습니다""",2
"""네, 제 번호는 **010-xxxx-xxxx** 입니다. 저장해 두셨다가 문의주시면 빠르게 도와드리겠습니다""",2
"""네, 정말입니다! 차량을 판매할 때 고객을 소개해주시면 광고비를 지급해드립니다. 궁금한 점 있으시면 말씀해 주세요""",2
"""네, 정말입니다! 자동차보험을 연결해주시면 광고비를 제공해드립니다. 궁금한 점이 있으시면 말씀해 주세요""",2
